"Hasil Derby Manchester, MU Tidak Berkutik                    "," Seperti di artikel sebelumnya* yang menyatakan bahwa MU akan sangat kesulitan untuk memenangkan pertandingan derby ini. Bahkan, peluang untuk menahan imbang tim rival sekotanya masih mencapai 40%. Artinya, belum ada kemungkinan yang besar, bahwa skuad asuhan Ole Gunnar Solskjaer ini dapat meraih hasil imbang, alih-alih kemenangan. Bukan karena kualitas MU yang buruk sekali, namun, karena taktik. Kekayaan taktik dan pengalaman bertarung dengan pelatih-pelatih hebat lebih banyak dimiliki Pep Guardiola bersama Manchester City dibandingkan Solskjaer. Sehingga, tidak mengherankan jika permainan City lebih 'enak' ditonton dibandingkan permainan Pogba dkk. Prediksi jika gawang David De Gea kebobolan lagi di laga ini memang tidak bisa dihindarkan. Karena, statistik penyerangan Manchester City sangat bagus. Lebih-lebih, City dalam beberapa laga terakhir sebelumnya juga mampu mencatatkan gol di menit-menit awal. Artinya, lini depan The Citizens sangat menakutkan bagi pertahanan MU. Bertindak sebagai tuan rumah, tidak serta-merta membuat MU mampu menguasai keadaan. Justru City yang mampu mengorkestrakan bola dengan baik dan hanya di babak pertama, mereka masih bermain hati-hati. Metode yang tepat untuk meladeni permainan MU yang biasanya berupaya berinisiasi terlebih dahulu di awal pertandingan. Namun sayangnya, target mencetak gol terlebih dahulu dan bertahan total, gagal terealisasi bagi MU. Inilah yang membuat MU tidak bisa sepenuhnya bermain dengan taktik bertahan. Apalagi ketika di babak kedua, mereka akhirnya menerima kenyataan bahwa gawang mereka (kembali) kebobolan. Maka, sebagai tim tuan rumah, taktik paling logis adalah keluar menyerang. Namun, sayang beribu sayang, City sudah mengetahui taktik itu, untuk itulah Pep menurunkan Leroy Sane. Pemain ini bisa dipastikan akan mampu memberikan daya tambah di penyerangan City. Khususnya dalam skema penyerangan cepat. Karena, dengan adanya Sane, City tidak hanya mengandalkan akselerasi Raheem Sterling, namun juga Sane. Terbukti, City mampu merangkai serangan cepat dan Sterling dengan kematangannya berhasil menyodorkan bola ke Sane. Gol kedua tercipta dan itulah gol 'killing the game' di laga ini. Sebab, faktor utama yang menghambat permainan MU adalah mampetnya keran gol mereka di beberapa laga terakhir. Untuk itulah, City tidak perlu mencari gol 'penyelesai pertandingan' lebih dari dua gol. Inilah yang kembali terjadi pada MU. Yaitu, tidak mampu mencetak gol, dan membuat MU harus mengakui kekalahan 'hanya' dengan skor 0-2. Sangat beruntung, pertahanan MU tidak begitu buruk, dan lini tengah mereka masih mampu berupaya keras untuk menandingi permainan kreatif City. Namun, jika sebuah tim dalam satu laga tidak dapat menghasilkan gol satupun, maka, bisa dipastikan bahwa tim tersebut tak berkutik. Ironisnya, hal inilah yang melanda kubu si 'Setan Merah'. MU tak berkutik di kandang sendiri, dan terjadi saat melawan si 'tetangga berisik' yang terus menerus menjaga kans juara Premier League dari musim ke musim. Pertanyaan yang muncul dan mungkin mewakili pendukung MU adalah, ""Kapan MU bangkit?"" Malang, 25 April 2019Deddy Husein S. *. Penulis sebelumnya menulis artikel 'preview' derby Manchester. Silakan baca di sini! "
Menanti Kisah Epik Liverpool di EPL 2018/2019                    ,"Pertandingan pekan ke-35 English Premier League (EPL) akhirnya tuntas digelar. Manchester United (MU) harus mengakui keunggulan tetangganya, Manchester City, dengan skor 2-0. Sementara itu, pesaing MU dalam perebutan tiket UEFA Champions League (UCL), Arsenal, juga tunduk oleh Wolverhampton Wanderers dengan skor 3-1. Situasi ini menjadikan The Citizen - julukan Manchester City - sebagai pemuncak klasemen dengan 89 poin, terpaut satu angka lebih banyak dibanding Liverpool. Sementara bagi MU dan Arsenal, tidak ada pergeseran peringkat yang cukup berarti. Arsenal berada di posisi kelima (66 poin); MU di posisi keenam (64 poin). Bagi pendukung Manchester City, kemenangan atas The Red Devils - julukan MU - akan memantapkan langkah tim kesayangannya dalam menatap tiga laga tersisa. Selama tiga pekan ke depan, tak akan ada lagi tim penghuni peringkat enam besar yang akan berjumpa dengan The Citizen. Burnley ada di posisi ke-15. Leicester City di posisi ke-10. Dan, Brighton and Hove Albion bahkan berada di peringkat ke-17. Praktis, Manchester City tak akan menemui kendala berarti menghadapi tiga laga tersisa. Perbedaan kasta dalam segi kualitas permainan, materi pemain dan kualitas pelatih menjadi alasannya.  Sementara Liverpool berkeyakinan bahwa, laga derby kota Manchester bukanlah satu-satunya penentu dalam menjuarai EPL. Dalam satu pernyataannya, Juergen Klopp menegaskan bahwa performa Liverpool-lah yang akan menentukan apakah mereka layak menjadi juara atau tidak. Bukan ditentukan oleh hasil akhir pertandingan lain. Di tiga laga terakhir, Liverpool akan menghadapi Huddersfield Town (peringkat ke-20), Newcastle United (peringkat ke-13), dan Wolverhampton Wanderers (peringkat ke-7). Tak hanya berhenti di situ. The Reds - julukan Liverpool - juga akan menghadapi Barcelona di laga semifinal UCL. Artinya, stamina dan mental para pemain Liverpool akan sangat diuji demi meraih hasil positif pada dua ajang tersebut. Lalu, bagaimana kans kedua tim - Liverpool dan Manchester City - dalam menjaga asa untuk menjadi kampiun EPL musim 2018/2019? Jawabannya adalah memastikan kemenangan di tiga pertandingan tersisa. Dan pertanyaan berikutnya, seberapa besar motif dan perlawanan keenam tim untuk memberi masalah bagi Liverpool dan Manchester City? Inilah skenario versi saya. vs Huddersfield Town Huddersfield Town saat ini berada di posisi juru kunci EPL (20). Dari 35 pertandingan, The Terriers - julukan Huddersfield Town - hanya mampu mencatat tiga kali kemenangan, lima hasil seri dan 27 kekalahan. Ketiga kemenangan itu diperoleh dari Wolverhampton Wanderers (dua kali) dan Fulham (sekali). Dengan Liverpool, The Terriers takluk 0-1 oleh gol Mohamed Salah pada medio Oktober 2018. Menilik tren Liverpool dan Huddersfield dalam lima pertandingan terakhir, besar kemungkinan Liverpool akan meraih poin penuh dalam laga tersebut. Selain itu, The Reds akan bertindak sebagai tuan rumah. vs Newcastle United Fans Liverpool tentu tidak akan melupakan kontribusi Newcastle United ketika The Magpies -julukan Newcastle United-mengalahkan Manchester City dengan skor 2-1 pada akhir Januari 2019. Kini, Newcastle United bertengger di peringkat 13 dengan capaian: 11 kemenangan, enam hasil seri dan 16 kekalahan. The Magpies masih berpeluang untuk menembus 10 besar dalam tiga laga tersisa. Karenanya, laga melawan Liverpool nanti dipastikan berjalan sengit. Kemenangan The Reds di putaran pertama pun tidak dapat dijadikan tolak ukur. Faktor Rafael Benitez juga akan berperan dalam menganalisis pola permainan Liverpool. Meski demikian, Liverpool akan habis-habisan untuk mengakhiri pertandingan dengan kemenangan. vs Wolverhampton Wanderers Adalah The Wolves - julukan Wolverhampton Wanderers - yang justru berpotensi memberi tekanan lebih terhadap Liverpool. Bagaimana tidak, Wolverhampton merupakan klub medioker yang mampu menahan, bahkan menaklukkan, tim enam besar klasemen EPL musim ini. Arsenal adalah korban terbaru mereka yang berhasil dikalahkan dengan skor 3-1 (25/04). Kini The Wolves menghuni peringkat ke-7, hasil dari 14 kemenangan, 9 hasil seri, dan 12 kekalahan. Ketika menjamu Liverpool di putaran pertama Desember 2018 silam, Wolverhampton Wanderers kalah 0-2. Tren ini tentu akan tetap dijaga oleh para punggawa The Reds. Apalagi, pertandingan akan berlangsung di Anfield. Tekanan meraih kemenangan bisa saja semakin besar. Bisa saja tidak. Alasannya, bertanding dengan The Wolves merupakan pertandingan pamungkas EPL. Selain itu, laga tersebut dilangsungkan setelah menjalani partai semifinal kedua UCL melawan Barcelona. Liverpool beruntung. Tren performa The Wolves di partai tandang tak selalu apik. Sehingga, tak sulit rasanya memprediksi kemenangan The Reds atas anak asuh Nuno Espirito Santo ini. Sebuah Kisah Epik Bagaimana dengan Manchester City? Tentu fans The Citizen berharap performa tim kesayangannya stabil hingga akhir musim. Sedikit turbulensi, akan memberi peluang bagi Liverpool merebut pole position. Banyak pihak menilai, ketiga tim calon lawan City - Burnley, Leicester City, dan Brighton and Hove Albion - diperkirakan tidak akan menghadirkan masalah berarti. "
Secarik Catatan untuk Manchester United                    ," Saya tak perlu menanyakan bagaimana kabar Mancunian hari ini. Namun yang jelas, Kamis, 25 April ini menjadi hari penuh awan kelabu bagi mereka, walau cuaca bertolak belakang. Saya juga tak perlu menanyakan bagaimana perasaan Mancunian terkait tren negatif yang kini tengah hinggap di Old Trafford. Hal pasti, seluruh pecinta MU berharap Paul Pogba dan kolega mampu mengakhiri rentetan hasil buruk yang mereka alami. Terkait hasil negatif ini, saya ingin memberi beberapa catatan, atau kasarnya komentar. Hal yang perlu Anda ketahui adalah catatan ini hanya hasil pengamatan saya dari apa yang sudah terjadi. Lain kata, catatan ini bisa jadi meleset, tetapi mungkin juga sebaliknya. Catatan pertama masalah kewibawaan pelatih.  Ooo... jangan berpikiran kemana-mana atau yang tidak-tidak terlebih dahulu. Menurut saya, sosok kepemimpinan Ole Gunnar Solskjaer di kursi pelatih saat ini tidak terlihat lagi. Bandingkan dengan saat ia masuk menggantikan Jose Mourinho. Saat ia bisa mengondusifkan ruang ganti serta membuat suasana di kamp latihan kembali cair mengalir. Ucapannya membuat para pemain termotivasi, hingga Ander Herrera mengungkapkan, ""Pelatih kami memberi tahu pada hari pertama (kedatangannya), cara terbaik untuk memenangkan pertandingan saat Anda memimpin ialah terus menyerang. Cara terbaik untuk bertahan adalah menjaga bola dan terus menyerang,"" ujar Herrera, seperti yang dilansir Mirror, Selasa (1/1/2019). Kedua, taktik. Ya, taktik yang digunakan Ole akhir-akhir ini perlu dipertanyakan. Saat laga melawan City misalnya, lima bek digunakan untuk membendung serangan tiki-taka ala the Sky Blue. Okelah saya apresiasi hal itu, tetapi fakta di atas lapangan membuat kita semua yang menyaksikan pertandingan itu geleng-geleng kepala.  Tembok pertahanan itu ternyata tidak cukup kuat untuk menyetop aliran bola dari kaki pemain City. Seharusnya Ole banyak belajar kepada Tottenham Hotspur saat melawan City pada perempat final UCL lalu. Hotspur mampu meredam permainan tiki-taka city dengan cara melawannya di lapangan tengah. Kita bisa lihat bagaimana barisan gelandang the Lilywhites bertarung all out menghadapi City. 

Tangkapan Layar
 Ketiga, permainan Paul Pogba. Menurut saya, sekali lagi ini hanya menurut pengamatan saya, semenjak rumor ketertarikan Real Madrid untuk mendatangkan dirinya musim depan, entah mengapa permainan Pogba menurun. Okelah Whoscored memberi nilai 7,35 atau tertinggi tenimbang pemain MU yang lain, tetapi daya juang dan tandingnya akhir-akhir ini menurun.  Kita tidak melihat permainan Pogba pada awal kepelatihan Ole. Sebagaimana dinukil dari tirto.id (31/12/2018), Pogba sudah mencetak empat gol hanya dalam tiga laga saja. Selain itu, tiga assist-nya juga berperan atas terciptanya gol-gol lainnya dari Si Iblis Merah dalam tiga pertandingan di bawah kendali Solskjaer. Keempat, secara keseluruhan, gaya permainan Marcus Rashford cs sangatlah mengecewakan fans. Rashford, seperti dikutip detikbola.com menyatakan, ""Hari ini, kami tak bermain seperti Manchester United. Ini salah. Paling minimal adalah untuk bekerja keras dan mengerahkan segala kemampuan untuk lambang di dada, suporter, klub, dan diri anda sendiri."" Tentunya, publik Old Trafford merindukan permainan MU saat berhasil membantai Cardif City (23/13/2018).  

FCBK.SU
 Jika Anda berminat mengetahui lebih lanjut permainan United Manchester pada laga tersebut, sila klik link di bawah ini: https://tirto.id/perubahan-cepat-manchester-united-di-tangan-solskjaer-dcvM "
"Lupakan EPL, Fokus Champions Liverpool                    ","English Premier League (EPL) sudah menyelesaikan pertandingan ke 35 yang ditutup dengan kemenangan 2-0 Manchester City dalam derby Manchester menghadapi Manchester United. Dengan hasil itu artinya Man.City saat ini memiliki 89 poin, unggul 1 poin dari Liverpool diposisi kedua (88 poin). EPL sendiri hanya menyisakan 3 pertandingan lagi untuk mengetahui siapa yang akan keluar sebagai juara, Manchester City atau Liverpool. Pada tiga laga terakhir EPL, City akan berhadapan dengan Burnley (A), Leicester City (H) dan Brighton (A). Poin penuh sepertinya akan dengan mudah diraih City dari ketiga pertandingan tersebut. Bukan mengganggap remeh tim yang lain, tapi yang harus diwaspadai hanyalah Leicester City yang pada paruh pertama musim ini berhasil mengalahkan city dengan skor 2-1 lewat gol Marc Albrighton dan Ricardo Pereira sedangkan City hanya berhasil membalas lewat Bernardo Silva. Sedangkan tiga laga terakhir Liverpool akan menghadapi Huddersfield (H), Newcastle (A) dan Wolverhampton Wanderers (H). Diatas kertas sepertinya akan sangat mudah bagi Liverpool untuk meraup poin maksimal dari sisa laga yang akan dijalaninya jika mengacu pada hasil pertandingan paruh pertama musim ini. Jika skenarionya berjalan seperti itu, maka pada akhir kompetisi Man.City lah yang akan keluar sebagai juara EPL 2018/19. Man.City total akan mengumpulkan 98 poin, sedangkan Liverpool 97 poin. Berharap Dari City atau Berjuang Sendiri Liverpool dan Manhester City sama-sama masih berpeluang merebut dua trophy, selain juara EPL Liverpool berpeluang menjuarai Liga Champions sedangkan City di FA Cup. Bedanya, Liverpool harus membagi waktu antara EPL dan Liga Champions sedangkan final FA Cup dilaksanakan tanggal 18 Mei 2019 atau seminggu setelah EPL berakhir. Hal ini juga akan menjadi keuntungan bagi City. Liverpool harus berupaya memenangkan sisa laga dan berharap City kalah atau minimal seri pada 1 dari sisa laganya. Hal yang sepertinya mustahil mengingat performa city yang sedang bagus-bagusnya. Dengan kesempatan menjuarai EPL yang semakin mengecil, fokus di Liga Champions akan menjadi lebih berharga bagi Liverpool. Dengan rekor pertemuan menghadapi Barcelona yang berpihak ke Liverpool, bukan tidak mungkin Liverpool akan maju ke partai final dan keluar sebagai juara. Tentunya harus dengan perjuangan ekstra diatas lapangan... "
Arti Pelukan Guardiola untuk Solskjaer Usai Derby di Old Trafford                    ," Laga ke-35 Premier League baru saja usai, Kamis (25/4/19) dini hari WIB, ketika Arsenal harus mengakui keunggulan Wolves dengan skor 1-3 di Molineux Stadium, Wolverhampton dan Manchester City menang 2-0 atas tuan rumah United di Old Trafford. Hasil ini telah mengubah posisi klasemen sementara dimana persaingan perebutan gelar juara antara City dan Liverpool semakin ketat demikian pula  perebutan posisi 4 besar. Usai laga Pep Guardiola memeluk Ole Gunnar Solskjaer sambil berkata dalam hatinya, terima kasih Brother sudah memberi jalan meunju tangga juara. Sebelum laga memang terdengar ada nada serba salah bagi United menghadapi derby ini. Jika menang mereka seperti mempersillahkan Liverpool, untuk juara.  Padahal klub ini adalah musuh bebuyutan lebih daripada tetangga mereka Manchester City. Maka ketika Pep dan Solskjaer berpelukan seusai laga derby malam itu, banyak yang tersenyum sambil menebak arti pelukan mereka.  Premierleague.com (25/4/19) merilis klasemen terbaru usai kedua laga tersebut, Manchester City kembali kepuncak klasemen dengan 89 poin menggeser Liverpool ditempat kedua dengan 88 poin. Posisi selanjutnya bertutur-turut, Tottenham (70 poin), Chelsea (67 poin), Arsenal (66 poin) dan Manchester United (64 poin).  Pep Guardiola menurunkan formasi seperti biasanya yaitu 4-3-3 dengan menempatkan trio penyerang Raheem Sterling, Bernardo Silva dan Aguero. Mereka ditunjang oleh trio lapangan tengah David Silva, Fernandinho dan Ilikay Gundogan.  Dengan komposisi tersebut beberapa kali mereka mengancam gawang David De Gea. Tercatat dua peluang dari Bernardo Silva dan Raheem Sterling dimentahkan oleh David De Gea. Skor masih sama kuat hingga babak pertama. Namun City mulai meningkatkan permainan mereka di babak kedua dan memimpin pada menit ke-54, ketika Bernardo Silva yang memotong bola dari sisi  kanan kemudian melepaskan tembakan dengan kaki kirinya melewati gawang yang dijaga David De Gea. Manchester United seperti tersentak dengan gol ini. Mereka kembali menyerang membuka peluang Jesse Lingard namun gagal dimanfaatkan dengan baik. Bahkan dua kali Lingard berpeluang memanfaatkan bola rebound dari Kiper Ederson.  Begitu pula Marcus Rashford melepaskan tembakan jarak jauh namun masih melebar. Serangan United sering kandas di area benteng pertahanan City yang dijaga kuartet Vincent Kompany, Laporte, Kyle Walker dan Zinchenko. Melalui serangan balik, gol kedua City akhirnya lahir pada menit ke-66 dari pemain pengganti Leroy Sane dengan tembakan akurat yang tak bisa dibendung Kiper De Gea.  Dua gol yang layak mereka dapatkan karena City bermain sangat mendominasi dengan penguasaan hampir 70 persen permainan. Mereka juga memiliki lini tengah yang lebih unggul dari United. Dengan kemenangan ini Pep Guardiola merasa lega karena City unggul satu poin dari Liverpool dengan jumlah laga yang sama. Keunggulan poin yang sangat berharga untuk tetap bisa dipertahankan hingga menyelesaikan 3 laga yang tersisa.  Menurut catatan Mancity.com (25/4/19), kemenangan ini juga menjadikan City adalah sebagai tim yang paling sukses bermain di Old Trafford dengan tujuh kemenangan atas tuan rumah Manchester United. Kesan mereka sebelum laga berlangsung terbukti bahwa Old Trafford sudah tidak angker lagi. Masih ada tiga laga sisa yang harus diselesaikan Manchester City yaitu melawan Burnley, Leicester dan Brighton. Untuk meraih juara City wajib memenangkan laga sisa tersebut.   "
"Tuntaskan Perlawanan MU, Manchester City Menangi Derby Manchester                    "," Derby Manchester sudah berakhir dan Manchester City keluar sebagai pemenang dengan mengalahkan tuan rumah Manchester United dengan dua gol tanpa balas. Gol pertama dicetak oleh Bernardo Silva pada menit ke-54, sedangkan gol kedua City dicetak oleh pemain pengganti Leroy Sane pada menit ke-66. Dengan hasil ini The Citizen kembali mengkudeta Liverpool dari puncak klasemen, yang membuat perebutan gelar juara liga Inggris antara Manchester City melawan Liverpool menjadi semakin seru. City mengemas 89 poin dari 35 laga, hanya unggul satu poin dari Liverpool di posisi kedua degnan 88 poin dari jumlah laga yang sama. United sendiri masih terpaku di peringkat keenam liga Inggris dengan 64 poin dari 35 laga yang membuat mereka akan semakin sulit untuk bisa finish di empat besar. Jalannya Pertandingan Awak babak pertama tampaknya masih sulit bagi kedua tim untuk membongkar pertahanan tim lawan. Akan tetapi terlihat bahwa Manchester City lebih dominan dengan memiliki beberapa peluang yang mengancam gawang United. Pada menit ke-15 percobaan tendangan Sterling dari luar kotak penalti memantul kaki Smalling sehingga bola berbelok, beruntung De Gea masih sigap dan mampu mengamankan bola. Tendangan keras Bernardo Silva di menit ke-19 dari luar kotak penalti juga masih mampu dimentahkan oleh De Gea. MU bukan tanpa peluang, umpan terobosan Lingard kepada Rashford gagal dimaksimalkan karena Rashford kalah cepat dengan Ederson.Tendangan keras Rashford pun masih melambung di atas mistar gawang. MU tercatat hanya melakukan satu tendangan tepat ke arah gawang oleh Paul Pogba yang masih bisa diamankan Ederson. Manchester City nyaris unggul pada akhir babak pertama, kemelut di kotak penalti United gagal dimaksimalkan oleh Raheem Sterling karena tembakannya masih terlalu lemah sehingga masih dapat diamankan oleh kiper MU, David De Gea. Babak pertama pun berakhir dengan kedudukan sama kuat 0-0. Babak kedua berjalan lebih seru, City yang berambisi untuk menang, langsung mengambil inisiatif serangan. Pada menit ke-54, Bernardo Silva menjadi pembeda dengan mencetak gol pertama The Citizen. Gol berawal dari umpan Gundogan kepada Bernardo di sisi kiri pertahanan United. Bernardo yang berhadapan dengan Luke Shaw pun melepaskan tembakan keras yang tak mampu dijangkau De Gea, 1-0 City unggul. Tendangan Aguero pada menit ke-56 nyaris menggandakan keunggulan City jika tidak membentur mistar gawang. Leroy Sane yang baru masuk menit ke-51 menggantikan Fernandinho akhirnya benar-benar menggandakan keunggulan City pada menit ke-66. Gol berawal dari Sterling yang melaju dari sisi kiri dan melepaskan umpan terobosan kepada Sane yang tidak dikawal dan Sane pun melepaskan tembakan yang gagal dihalau oleh De Gea. MU memasukkan Lukaku menggantikan Andreas Pereira pada menit ke-72 untuk menambah pemain depan dan untuk menambah daya serang. Akan tetapi tidak mampu dimaksimalkan dengan baik. Begitu juga dengan Anthony Martial yang menggantikan Jesse Lingard dan Alexis Sanchez yang menggantikan Darmian pada menit ke-83 . Usaha yang dilakukan oleh Solskjaer tak membuahkan hasil, skor 2-0 untuk keunggulan City bertahan hingga laga usai, dan Manchester City memenangi derby Manchester dan kembali ke puncak klasemen sementara liga primer Inggris. Susunan Pemain Manchester United : De Gea; Darmian (Sanchez 83), Young, Shaw, Lindelof, Smalling; Fred, Pereira (Lukaku 72), Pogba; Lingard (Martial 83), Rashford Manchester City : Ederson; Walker, Kompany, Laporte, Zinchenko; Fernandinho (Sane 51), Gundogan (Danilo 89), Silva; Bernardo, Sterling, Aguero (Jesus 89) "
PSG Persembahkan Gelar Juaranya untuk Katedral Notre-Dame                    ,"Setelah sempat tertunda dua pekan terakhir akibat alami kekalahan beruntun, PSG akhirnya merayakan gelar juaranya musim ini seusai memenangkan laga kontra AS Monaco 3-1  di mana Kylian Mbappe menjadi bintang lapangan dengan cetak hatrrick Pada laga yang di gelar di Parc des Princes, Senin (22/4/2019) dinihari WIB.Gelar tersebut bahkan sudah berhasil di kantongi PSG, Karena beberapa jam sebelumnya Rival terdekatnya Lille, cuma bermain imbang 0-0 kontra Tollouse.Alhasil, PSG pun kokoh di puncak klasemen Liga Prancis dengan torehan 84 poin dari 33 laga. Raihan tersebut membuat tim besutan Thomas Tuchel itu unggul telak 19 poin dari Lille, Dengan kompetisi  yang masih menyisakan 5 laga lagi. Perayaan gelar Juara yang Tanpa Pesta Malam itu mungkin adalah malam yang sangat indah bagi penghuni kota Paris, Sebab tim kesayangan mereka Paris Saint Germains berhasil merajai Liga Perancis musim ini. Mereka pun pantas merayakan dengan hingar bingar kemeriahan pesta, Namun Perayaan gelar tersebut terbilang jauh dari lumrahnya  pesta, Hal itu mungkin di pengaruhi karena langit kota Paris masih di selimuti mendung tebal atas insiden kebakaran Katedral Notre-Dame pada malam hari 15 April lalu, Kebakaran tersebut berlangsung kurang lebih 15 jam. Maka dari itu dalam laga pengukuh juara kontra AS Monaco,Pihak Les Parisien telah merencanakan untuk mempersembahkan gelar juara mereka kepada katedral bersejarah di kota Paris tersebut. PSG Persembahkan Juara untuk Katedral Notre-Dame Pada Laga malam itu  tampak para penggawa PSG, Termasuk Neymar yang baru pulih dari cedera, Turut mengenakan jersey dengan gambar katedral tersebut di bagian depan. Sementara pada bagian belakang jersey seluruh nama penggawa tim digantikan tulisan Notre-Dame. 

jateng.tribunnews.com
Sementara pada bagian tribune, Terpampang pula para suporter yang turut merayakan gelar juara tim kesayangannya dengan spanduk besar bergambar katedral sebagai sebuah tribut kepada situs bersejarah  yang telah berusia 674 tahun tersebut. 

detik.com
Oh iya, Bagi PSG Ini merupakan gelar liga keenam Les Parisiens dalam tujuh musim terakhir atau yang kedelapan sepanjang sejarah Liga Prancis. 

bola.com
------  "
