Mari Menunggu Kejutan Pemain Indonesia di Babak II Singapore Open                    ,"Turnamen bulutangkis Singapore Open 2019 yang mulai digelar Selasa (9/4/2019), kini akan memasuki putaran kedua alias round 2. Dari 27 pemain/pasangan Indonesia yang tampil di turnamen BWF World Tour Super 500 ini, ada 12 pemain yang berhasil lolos ke putaran II. Artinya, ada 15 pemain yang langsung tereliminasi di babak pertama.  Hari ini, Kamis (11/4), pemain-pemain Indonesia yang tampil di putaran kedua, akan berjuang merebut 'tiket lolos' menuju babak perempat final. Tidak akan mudah untuk menapak ke perempat final. Pasalnya, beberapa pemain Indonesia harus menghadapi beberapa pemain unggulan utama. Di tunggal putra, dari enam pemain yang tampil, tersisa Jonatan Christie dan Anthony Sinisuka Ginting. Keduanya berhasil mengawali turnamen dengan manis. Jojo--panggilan Jonatan Christie--berhasil mengalahkan pemain Thailand, Khosit Phetpradab lewat rubber game 21-18, 19-21, 21-18. Sementara Ginting menang atas pemain Taiwan, Wang Tzu-wei dengan skor 21-12, 21-12. Di putaran II, Jonatan akan menghadapi pemain Malaysia, Lee Zii Jia. Sementara Ginting akan menghadapi pemain Jepang, Kenta Nishimoto. Bagi Ginting, pertemuan dengan Nishimoto akan menjadi kesempatan revans alias membalas kekalahan. Pekan lalu, Ginting dikalahkan Nishimoto di putaran pertama Malaysia Open 2019 dengan skor 21-18, 13-21, 21-23. Dikutip dari badmintonindonesia.org, Ginting menyebut telah belajar dari kekalahan di Malaysia yang menurutnya dikarenakan dirinya kurang bisa mengontrol faktor angin.  ""Kali ini saya harus coba buat lebih sabar lagi dan menikmati permainan. Harus diingat bahwa lawan Jepang itu tidak mudah, dengan siapa saja. Harus siap capek dan siap susah,"" ujarnya. Sementara di sektor tunggal putri, dari lima pemain yang tampil di Singapore Open, empat pemain langsung tersingkir. Dua diantaranya tunggal putri utama Pelatnas, Fitriani dan Gregoria Mariska Tunjung yang diproyeksikan tampil menuju Olimpiade 2020. Fitriani takluk dari pemain terbaik Thailand, Ratchanok Intanon dua game langsung 18-21, 14-21. Sementara Gregoria kalah dari pemain Denmark, Mia Blichfeldt 16-21, 20-22. Hanya Ruselli Hartawan yang berhasil lolos ke round 2. Ruselli berhasil mengalahkan pemain tuan rumah, Yeo Jia Min lewat rubber game dengan skor 21-18, 17-21, 21-15. Menariknya, di putaran II, Ruselli akan bertemu unggulan 7 asal Korea, Sung Ji-hyun. Pekan lalu di Malaysia Open 2019, pemain Korea inilah yang mengalahkan Fitriani di babak pertama. Di sektor ganda putra, Indonesia masih memiliki tiga wakil. Yakni Marcus Gideon/Kevin Sanjaya, Fajar Alfian/Muhammad Rian Ardianto dan Hendra Setiawan/Mohammad Ahsan yang merupakan juara bertahan Singapore Open 2018. Menariknya, ketiganya lolos ke putara II setelah memenangi perang saudara di putaran pertama. Di round 2 yang dimainkan Kamis (11/4), Marcus/Kevin bertemu ganda putra China, He Jiting/Tan Qiang. Sementara Fajar/Rian bertemu ganda Malaysia yang lolos dari babak kualifikasi, Chooi Kah Ming/Low Juan Shen. Adapun Hendra/Ahsan bertemu rival lama dari Korea, Lee Yong-dae yang kini punya pasangan baru, Kim Gi-jung. Di sektor ganda putri, dari empat pasangan yang tampil, hanya pasangan Yulfirah Barkah/Jauza Fadhila yang berhasil lolos ke round 2. Sementara tiga pasangan lainnya, yakni Ni Ketut Mahadewi/Rizki Amelia Pradipta, Della Destiara/Tania Oktaviani Kusumah serta Pia Zebadiah/Anggia Shitta Awanda, langsung tereliminasi. Menariknya, di putaran kedua, Yulfira/Jauza harus menghadapi lawan tangguh. Mereka bertemu pasangan Jepang, Wakana Nagahara/Mayu Matsumoto yang merupakan juara dunia 2018. Ganda putri Jepang yang menjadi unggulan 3 ini lolos ke round 2 dengan kemenangan sadis atas ganda Thailand, 21-6, 21-5. ""Kami mau main lebih lepas aja karena lawan jauh di atas kami. Mainnya harus lebih enak aja. Besok pengen main bagus, semua yang kami punya ingin dikeluarkan,"" ujar Yulfira. Sektor ganda campuran meloloskan wakil terbanyak ke putaran II. Ada lima pasangan ganda campuran Indonesia yang berhasil lolos ke round 2. Salah satunya Praveen Jordan/Melati Daeva Oktavianti. Praveen/Melati yang mencoba memburu gelar pertama mereka di Singapore Open, mengawali turnamen dengan mengalahkan pasangan Mohamad Arif Abdul Latif (Malaysia)/Rusydina Riodingin (Indonesia) 21-12, 21-16. Namun, harapan Praveen/Melati untuk melangkah jauh di turnamen ini tidak akan mudah. Sebab, mereka akan menghadapi ganda Tiongkok langganan juara, Zheng Siwei/Huang Yaqiong. Pertemuan Praveen/Melati menghadapi pasangan juara dunia 2018 ini akan menjadi ulangan semifinal All England 2019 pada awal Maret lalu. Kala itu, Praveen/Melati yang unggul di game pertama, nyaris menang straight game. Sayangnya, mereka tertikung di poin kritis pada game kedua dan akhirnya kalah rubber game 21-13, 20-22, 13-21. Dikutip dari badmintonindonesia.org, Melati menyebut akan berusaha tampil maksimal dalam pertemuan kelima melawan Siwei/Yaqiong. Sejauh ini, Praveen/Melati belum pernah menang. ""Sama dengan seperti di All England, kami nggak mau mikir menang kalah. Yang penting main semaksimal mungkin dan mengeluarkan penampilan terbaik kami,"" kata Melati. Sayangnya, dua pasangan Indonesia dipastikan tersingkir di round 2 ini. Pasalnya, rute drawing mengharuskan empat pasangan ganda campuran harus melakoni ""perang saudara"". Rinov Rivaldy/Pitha Mentari akan bertemu Hafiz Faisal/Gloria Widjaja. Sementara Ronald/Annisa Saufika yang kemarin membuat kejutan dengan memulangkan unggulan 8 asal China, He Jiting/Du Yue, akan bertemu Ricky Karanda Suwardi/Pia Zebadiah. Ah, menarik ditunggu bagaimana perjuangan pemain-pemain Indonesia di round 2 Singapore Open 2019. Siapa tahu ada kejutan-kejutan hebat yang muncul. Salam bulutangkis. "
Ketika Duo Tim Manchester Takluk                    ," Dari ajang UEFA Champions League 2018/2019 atau Liga Champions Eropa kini memasuki babak 8 besar alias perempat final , ada 4 tim Premier League cukup mendominasi dibabak ini . Tottenham Hotspur , Manchester City , Liverpool serta Manchester United .  Pertandingan antara dua tim Premier League Tottenham Hotspur vs Manchester City menjadi duel yang menarik , dimana pada akhirnya untuk laga leg pertama ini , pasukan Mauricio Pochettino berhasil meraih kemenangan tipis 1-0 di stadion barunya berkat gol Son Heung-Min .  Dipertandingan lainnya mempertemukan Liverpool dengan tim asal Portugal FC Porto , dimana tim The Reds akhirnya sukses meraih kemenangan dengan skor akhir 2-0 berkat gol yang dicetak oleh Naby Keita dan Roberto Firmino juga pertandingan berlangsung di Anfield Stadium . Untuk laga antara Manchester United kontra Barcelona yang berlangsung di Old Trafford juga menjadi laga yang menarik ditunggu dan hasilnya pasukan Ernesto Valverde berhasil unggul tipis 0-1 berkat gol bunuh diri Luke Shaw . Serta duel sengit antara tim Eredivisie Belanda Ajax Amsterdam yang hadapi lawannya tim Serie A Italia Juventus . Pertandingan yang berlangsung di Amsterdam Arena ini berakhir imbang dengan skor 1-1 . Juventus sempat mencetak gol lebih dulu lewat gol Cristiano Ronaldo sebelum akhirnya bisa disamakan oleh gol David Neres . Untuk laga leg kedua akan berlangsung pada tanggal 16-17 April 2019 nanti . Menarik kita tunggu , siapakah yang akan berhasil lolos ke babak semifinal ?  Demikian saya Irfan Maulana terima kasih dan salam olahraga . "
Pentingnya Komunikasi Olahraga                    ,"Pentingnya Komunikasi Olahraga       Berhasilnya tim sepak bola Indonesia menjuarai piala AFF U-22 2019, menjadi perhatian masyarakat khususnya pecinta sepak bola, Setelah mengalahkan Thailand 2 - 1 di Stadion Nasional Phnom Panh,  Kamboja. Faktor komunikasi tidak lepas dari contoh susksesnya timnas Indonesia,  komunikasi  interpersonal terus di bangun oleh pelatih  indra Sjafri dan manager tim dengan atlet binaannya. Terlepas dari suksesnya timnas Indonesia  tersebut, kita akan bahas pentingnya komunikasi olahraga.  Dalam teori ,komunikasi adalah proses penyampaian informasi, gagasan, emosi, keahlian,dan lain - lain melalui penggunaan simbol -simbol,seperti kata - kata gambar, angka dan lain - lain  yang disampaikan oleh  Berelson dan Steiner, 1964 .  Demikian juga dalam organisasi keolahragaan ,salah satu hal terpenting yaitu Komunikasi. Tepatnya komunikasi interpersonal, yang sangat ditekankan dalam komunikasi  olahraga. Pada komunikasi interpersonal ,kita didorong untuk berkomunikasi antar peribadi yang   intensif .  Seperti diutarakan oleh Joseph A. DeVito ( 1997 ) komunikasi interpersonal  adalah ""The procces of sending and receiving messages betwen two persons, or among a small group of persons, with some effect and some immediate feedback"" ( proses pengiriman dan penerimaan di antara dua orang atau di antara sekelompok kecil  atau orang  dengan  beberapa efek dan berupa umpan balik seketika) komunikasi interpersonal  merupakan komunikasi tatap muka sehingga mampu terjadi umpan balik dari orang yang menerimanya. Pada induk organisasi olahraga ,ataupun organisasi lainnya seorang pemimpinan adalah orang yang dapat dicontoh dan ditiru oleh anggota lainnya. Dan dapat berkomumikasi secara interpersonal / antar pribadi, dan  tatap muka agar  terjadi umpan balik atau feedback. Sehingga tidak terjadi  komunikasi  yang negatif dengan bawahannya atau sebaliknya. Mengelola organisasi yang kurang tepat  juga banyak terjadi, karena komunikasi interpersonal yang tidak berjalan dengan baik. Bila kita tinjau dari sudut konunikasi, Ini dimulai dari adanya komunikasi antar pribadi yang kurang tepat.  Contoh, komunikasi olahraga yang dibangun bernada ajakan untuk memengaruhi  orang atau sekelompok orang  , dan akhirnya mereka mau diajak  kerjasama untuk berbuat kekeliruan . Ujung-ujungnya menggunakan uang negara untuk kepentingan pribadi maupun kelompoknya alias korupsi di dalam organisasi keolahragaan. Bila ditinjau dari efektivitas  Komunikasi interpersonal,ini mempunyai ciri-ciri, seperti diutarakan oleh Kumar tahun 2000, yaitu :a.  Keterbukaan ( openess)b.  Empati (empathy)c.  Dukungan (supportivennes)d.  Rosa positif (positiveness)e.  Kesetaraan (akuality) Teori  tersebut adalah ciri-ciri dari  komunikasi antar pribadi  ,dan  harus mempunyai hubungan antar pribadi di organisasi keolahragaan.  Dan komunikasi olahraga itu, bila dibangun dengan benar dan tepat maka kita yakin komunikasi antar pribadi / interpersonal menjadi penting dan bermanfaat. Bagi kepentingan organisasi olahraga, maupun atlet dalam mencapai prestasi olahraga yang sudah ditargetkan oleh pelatih dan manager  tentunya.( oleh: JL.Telussa)   "
Manchester United Vs Barcelona: Neraka! (3)                    ,"Manchester United vs Barcelona, leg pertama babak perempat final Liga Champions sebentar lagi akan berlangsung di Old Trafford. Saat tulisan ini dibuat sekitar setengah jam lagi pertandingan Manchester United vs Barcelona dimulai. Wajar saja jika ada sebagian pihak yang berdebar-debar menunggu prediksi pertandingan ini. Seperti dikatakan pada tulisan sebelumnya, pembahasan Manchester United vs Barcelona ini akan terdiri dari tiga tulisan. Dua tulisan pertama membahas hal yang ringan saja, sedangkan bagian ketiga merupakan prediksi pertandingan tersebut. Bagaimana prediksi big match leg pertama babak perempat final Manchester United dan Barcelona ini? Apakah skor akhir pertandingan memenangkan Manchester United atau Barcelona? Jangan-jangan skor akhirnya imbang? Mungkin ada sebagian pihak penggemar bola sejati yang sudah menunggu bagian ketiga tulisan yang membahas pertandingan Manchester United vs Barcelona ini sejak tadi, karena dijanjikan beberapa jam sebelum pertandingannya dimulai akan ada prediksi yang jitu atau akurat, seperti biasa. Apakah sebagian penggemar bola yang sudah sejak tadi menunggu prediksi Manchester United vs Barcelona ini ada juga yang menyukai judi bola? Lalu ingin menjadikan prediksi yang jitu atau akurat ini sebagai tolak ukur untuk bermain judi bola tadi? Jika masih ada yang senang main judi bola, sekali lagi diingatkan! Inga-inga! Judi menjanjikan kemenangan, tapi semua itu bohong! Awalnya saja mungkin mendatangkan kegembiraan atau kesenangan, tapi semua itu sebenarnya hanya pancingan agar terus menerus bermain judi, dan akhirnya menyes...menyesal! Maka dari itu, jauhkan diri Anda dari judi bola dan judi-judi bentuk lainnya sebelum tenggelam dan semakin tenggelam dalam sengsara serta kesusahan diri yang tak bertepi. Sadarlah, judi bola dan judi lainnya hanya menipu diri Anda. Jika Anda senang ditipu, dibohongi, diklecein, dikadalin, atau seperti itu, berarti Anda termasuk manusia dungu. Inga-inga! Kata apa yang sering diucapkan oleh Rocky Gerung? Sepertinya pertandingan Manchester United vs Barcelona, leg pertama babak perempat final ini sebentar lagi akan dimulai.  Mohon mangap, maksudnya mohon maaf tidak ada prediksi pertandingan Manchester United vs Barcelona.  Salam bola itu bundar, bukan peang. "
Hampir Semua Pemain Prioritas Olimpiade Tokyo Tampil di Singapore Open 2019                    ,"                                                                                                                      (Dokumentasi: www.bulutangkis.com) Rombongan pemain Indonesia yang diperkuat oleh sebagian besar penghuni pelatnas utama yang diprioritaskan tampil di Olimpiade Tokyo, tampil kembali di turnamen dengan level super 500 Singapore Open 2019 yang diselenggarakan dari tanggal 9 s/d 14 April 2019 di kota Singapura, Singapura.             Dalam turnamen ini, Indonesia mengikutsertakan 27 wakilnya yang terdiri dari 6 pemain sektor tunggal putra, 5 pemain sektor tunggal putri, 6 pasangan sektor ganda putra yang antara lain diperkuat oleh pasangan terbaik dunia Marcus/Kevin yang diunggulkan di posisi pertama. Selanjutnya 4 pasangan sektor ganda putri dan sektor ganda campuran yang mengirimkan 6 wakilnya. Berdasarkan daftar unggulan pemain, pemain Indonesia yang berpeluang besar untuk tampil sebagai juara adalah di sektor ganda putra yaitu pasangan Marcus/Kevin yang diunggulkan di posisi pertama. Pemain Indonesia lainnya yang diunggulkan adalah Anthony Sinisuka Ginting yang diunggulkan di posisi ketujuh dan Tommy Sugiarto yang diunggulkan di posisi kedelapan sektor tunggal putra. Mohammad Ahsan/Hendra Setiawan diunggulkan di posisi keempat dan Fajar/Rian diunggulkan di posisi kedelapan sektor ganda putra. Hafiz Faizal/Gloria diunggulkan di posisi ketujuh sektor ganda campuran. Hari pertama Selasa (9/4/2019), baru menyelesaikan babak kualifikasi, di sektor tunggal putra tiga pemain yang diturunkan, semuanya gagal lolos ke babak utama. Pemain yang gagal lolos ke babak utama tersebut adalah pemain senior Sony Dwi Kuncoro yang menderita kekalahan rubber set dari pemain Jepang Yu Igarashi dengan skor 19-21  21-14 dan 3-4 (mengundurkan diri). Selanjutnya, Shesar Hiren Rhustavito harus angkat koper dari Singapura Open 2019 setelah menderita kekalahan melalui pertarungan rubber set dari pemain Hongkong Wong Wing Ki Vincent dengan skor 10-21  21-19 dan 9-21. Begitu juga dengan Ihsan Maulana Mustofa, ia menderita kekalahan melalui pertarungan dua set langsung dari pemain Thailand Sitthikom Thammasin dengan skor 14-21 dan 10-21. Berikutnya sektor ganda putra, satu-satunya pasangan yang harus turun di babak kualifikasi, juga gagal lolos kebabak utama. Pasangan Ricky Karandasuwardi/Angga Pratama menderita kekalahan melalui pertarungan dua set langsung dari pasangan tuan rumah Tan Wen Sing Abel/Toh Han Zhuo dengan skor 13-21 dan 6-21. Selanjutnya sektor ganda putri, sama dengan sektor ganda putra, ada satu pasangan yang harus melalui babak kualifikasi. Satu-satunya pasangan yang harus turun di babak kualifikasi, Della Destiara Haris/Tania Oktaviani Kusumah berhasil menang WO atas pasangan tuan rumah Jin Yujia/Lim Ming Hui. Untuk sektor tunggal putri dan ganda campuran, semuanya langsung lolos ke babak utama. "
"Masih Belum Aman, Reds!                    "," Satu kaki Liverpool sudah berada di babak semifinal Liga Champions. Begitulah kira-kira mayoritas pendapat yang muncul, segera setelah tim asuhan Jurgen Klopp mengalahkan FC Porto 2-0, di laga leg pertama babak perempatfinal Liga Champions, Rabu (10/4, dinihari WIB) di Anfield. Tapi, saya tak sepenuhnya sependapat dengan itu. Mengapa? Karena, tren di Liga Champions musim ini tergolong sulit ditebak. Sebagai contoh, Real Madrid (juara musim lalu) tersingkir di babak perdelapan final, meski di leg pertama menang 2-1 atas tuan rumah Ajax Amsterdam. Contoh lainnya, PSG tersingkir secara dramatis di babak yang sama, meski di leg pertama menang 2-0 atas tuan rumah Manchester United di Old Trafford. Jadi, Liverpool dan Kopites belum sepenuhnya bisa bernapas lega. Ini baru separuh jalan, semua masih bisa terjadi. Masalah lainnya, meski bermain cukup baik, tanpa kebobolan, kualitas penyelesaian akhir Roberto Firmino dkk masih belum optimal. Oke, Si Merah berhasil mencetak gol lewat aksi Naby Keita dan Roberto Firmino. Tapi, ada sejumlah peluang bersih yang gagal dikonversi menjadi gol. Sementara itu, lini serang FC Porto yang dimotori oleh Moussa Marega (Mali) sebenarnya kerap menebar ancaman bagi lini belakang Liverpool. Beruntung, kurang optimalnya kualitas penyelesaian akhir, dan penampilan disiplin lini belakang Liverpool membuat gawang Alisson bebas dari kebobolan. Tapi, berhubung Liverpool masih harus gantian bertandang ke markas FC Porto pekan depan, mereka belum sepenuhnya aman. Apalagi, di babak perdelapan final lalu, ada Atletico Madrid, yang kalah agregat 2-3 dari Juventus, meski menang 2-0 di leg pertama. Jelas, mereka harus tetap waspada, karena Si Naga (julukan FC Porto) pasti punya motivasi lebih saat bermain di kandang. Jangan lupa, di babak sebelumnya, Iker Casillas dkk sukses mengalahkan AS Roma, meski sempat kalah 1-2 di leg pertama, saat bertandang ke Stadio Olimpico. Kebetulan, situasinya cukup mirip dengan saat ini. Jadi, bisa dipastikan FC Porto pasti akan tampil all-out di leg kedua, untuk setidaknya dapat mengejar defisit gol, bahkan membalikkan keadaan. Tantangan lainnya, pada akhir pekan ini Mohamed Salah dkk harus bersiap menghadapi tantangan Chelsea di liga domestik, sebelum melakoni pertandingan leg kedua melawan Porto. Di sini, mereka dituntut untuk dapat tampil sama baiknya di kedua pertandingan krusial ini, karena disinilah titik penentuan nasib The Reds musim ini. Jika mampu meraih hasil positif di sini, kita akan melihat, kualitas mereka secara umum sudah meningkat dibanding musim lalu, karena di musim ini, mereka sudah mampu menikmati tekanan dalam pertandingan di fase krusial pada kompetisi domestik dan Eropa dengan sama baiknya. Selebihnya, mari kita nikmati aksi mereka di lapangan hijau. Siapa tahu, mereka dapat meraih trofi juara musim ini. Mampukah Liverpool membuktikan diri? "
Manchester United vs Barcelona Liga Champions                    ,"Sepanjang sejarah Setan Merah, Spanyol menjadi negara yang klubnya paling sering ditemui United di ajang Eropa. karena ajang ini juga paling sering dinanti nati para pecinta bola terutama suporter maniak masing-masing klub, bentuk euforia tersebut tergambar dari banyaknya yang mengadakan nonton bareng di berbagai tempat.  Setiap suporter akan optimisi tim yang didukungnya kana menang, tetapi untuk menentukan semua itu kita perlu mununggu sampe pluit 90 menit terakhir dibunyikan oleh wasit.  berikut statistik yang kedua kubu tersebut : Head to Head 10 Pertandingan Terakhir Sepuluh Laga Terakhir Barcelona Versus Klub Inggris 1.  8 Maret 2011 Barcelona 3-1 Arsenal [Liga Champions]2.  16 Februari 2011 Arsenal 2-1 Barcelona [Liga Champions]3.  6 April 2010 Barcelona 4-1 Arsenal [Liga Champions]4.  31 Maret 2010 Arsenal 2-2 Barcelona [Liga Champions]5.  27 Mei 2009 Barcelona 2-0 Manchester United [Liga Champions]6.  6 Mei 2009 Chelsea 1-1 Barcelona [Liga Champions]7.  28 April 2009 Barcelona 0-0 Chelsea [Liga Champions]8.  29 April 2008 Manchester United 1-0 Barcelona [Liga Champions]9.  23 April 2008 Barcelona 0-0 Manchester United [Liga Champions]10. 6 Maret 2007 Liverpool 0-1 Barcelona [Liga Champions] Sepuluh Laga Terakhir Manchester United Versus Klub Spanyol 1.  8 Desember 2010 Manchester United 1-1 Valencia [Liga Champions]2.  29 September 2010 Valencia 0-1 Manchester United [Liga Champions]3.  27 Mei 2009 Barcelona 2-0 Manchester United [Liga Champions]4.  25 September 2008 Villarreal 0-0 Manchester United [Liga Champions]5.  17 September 2008 Manchester United 0-0 Villarreal [Liga Champions]6.  29 April 2008 Manchester United 1-0 Barcelona [Liga Champions]7.  23 April 2008 Barcelona 0-0 Manchester United [Liga Champions]8.  22 September 2005 Manchester United 0-0 Villarreal [Liga Champions]9.  14 September 2005 Villarreal 0-0 Manchester United [Liga Champions]10. 23 April 2003 Manchester United 4-3 Real Madrid [Liga Champions] Perikiraan Susunan Pemain Dari livescore.com Susunan Pemain Manchester United - David De Gea (GK)- Victor Nilsson Lindeloef- Chris Smalling- Ashley Young- Luke Shaw- Paul Pogba- Ander Herrera- Nemanja Matic- Marcus Rashford- Anthony Martial- Jesse LingardPelatih:Ole Gunnar Solskjaer---------------------------Susunan Pemain Barcelona- Marc-Andre ter Stegen (GK)- Nelson Semedo- Gerard Pique- Clement Lenglet- Jordi Alba- Ivan Rakitic- Sergio Busquets- Arthur- Arturo Vidal- Luis Suarez- Lionel MessiPelatih:Ernesto Valverde ------------------------------- Penulis - www.infoberbagi.web.id "
Mampukah Persebaya Bikin Kejutan Memboyong Piala Presiden?                    ,"Dalam hitungan jam, turnamen Piala Presiden tahun ini akan berakhir. Dua klub terbaik sesama berasal dari Jawa Timur akan bertarung selama 90 menit untuk menentukan klub mana yang berhak memboyong trofi yang dirancang dengan artistik ini oleh seniman dari Yogyakarta. Dua klub dimaksud adalah Persebaya Surabaya dan Arema Malang. Pada laga final leg pertama, Selasa (9/4/2019) lalu, Persebaya yang menjadi tuan rumah di Gelora Bung Tomo Surabaya hanya mampu bermain imbang 2-2 dengan Arema. Nah tentu saja Arema yang pada laga leg kedua malam ini, Jumat (12/4/2019), menjadi tuan rumah di Stadion Kanjuruhan Malang lebih diuntungkan. Sekiranya skor akhir imbang 0-0 atau 1-1, maka Presiden Joko Widodo yang rencananya akan hadir pada laga penutupan tersebut akan menyerahka trofi pada Arema. Maka, bagi Persebaya jika ingin membuat kejutan, harus mampu memenangi pertandingan. Kalaupun seri, harus dengan skor minimal 3-3. Ketentuannya, bila seri, tim yang lebih banyak mencetak gol di kandang lawan, itulah yang menang. Persebaya tidak saja harus menghadapi sebelas orang pemain Arema, tapi juga puluhan ribu Aremania yang memenuhi tribun stadion yang dengan berbagai atraksinya akan membakar semangat pemain Arema. Tapi bukan hal yang mustahil Persebaya mencetak sejarah. Trio pemain asingnya lumayan menjanjikan yakni Damian Lizio, Manu Dzalilov dan Amido Balde. Belum lagi kelincahan Irfan Jaya dan Osvaldo Haay yang bisa menyulitkan barisan pertahanan Arema. Namun tentu Hamka Hamzah sebagai palang pintu Arema akan menghadang setiap penetrasi penyerang Persebaya. Di lain pihak, kunci permainan Arema berada di kaki Makan Konate, pemain berpaspor Mali, yang cerdik mencari ruang kosong, tajam umpan-umpannya, dan tendangan bebasnya juga dahsyat. Gol kedua Arema di Gelora Bung Tomo lahir dari tendangan bebas Makan Konate. Tak ada jalan lain, Otavio Dutra yang menjadi jenderal di daerah pertahanan Persebaya harus menempel ketat Makan Konate, tanpa mengurangi kewaspadaan pada pergerakan lincah Ricky Kayame, pemain yang tahun lalu masih berseragam Persebaya. Laga pamungkas tersebut juga menjadi adu gengsi antar dua orang top skor, Manu Dzalilov dari Persebaya dan Dedik Setiawan dari Arema. Juga adu kehebatan juru racik antar pelatih Persebaya, Djadjang Nurdjaman dan pelatih Arema, Milomir Seslija. Jika Persebaya gagal membuat kejutan, maka Arema akan mengulang prestasi mereka di tahun 2017 lalu, saat meraih Piala Presiden dengan mengalahkan Borneo FC di laga final. Yang jelas, baik Persebaya maupun Arema, sama-sama menganut permainan terbuka, agresif dalam menyerang. Hal ini diyakini akan menjadi tontonan yang menghibur.  Sepanjang kedua klub bermain dengan performa terbaiknya, wasit mampu memimpin secara adil, dan tidak ada aksi anarki penonton, maka klub mana yang menang tidak perlu diperdebatkan, toh semua demi kemajuan sepak bola Indonesia.  "
