"Preview Balap F1 GP China, Menuju Balapan ke-1000                    "," Akhirnya balapan Formula 1 akan bergulir kembali di GP China hari minggu ini yang akan berlangsung di Shanghai International Circuit. Didapuk menjadi seri ketiga tahun ini akan memulai perhelatan balapannya dari hari Jumat untuk latihan bebas pertama dan kedua, lalu hari Sabtu untuk latihan bebas ketiga dan kualifikasi, dan hari Minggu untuk hari balapannya. Balapan sendiri akan dijalankan sebanyak 56 putaran. Sebelum mepreview apa saja poin penting pada balapan nanti, kita harus lebih dulu tahu tentang sirkuit Shanghai itu sendiri. Shanghai International Circuit Shanghai International Circuit sendiri di bangun pada bulan April 2003 dan didisain oleh perancang sirkuit terkenal Herman Tilke. Pengerjaan Sirkuit ini sendiri membutuhkan waktu 18 bulan dan memakan biaya hingga 450 Milliar Dollar Amerika.  Sirkuit Shanghai masuk kedalam kalender F1 pada tahun 2004, kala itu sirkuit Shanghai didaulat menjadi seri balapan ke-16 dari 18 seri yang dijalankan pada tahun 2004 dan dimenangkan pertama kali oleh Rubens Barichello dari tim Ferrari. Sirkuit Shanghai mempunyai 16 tikungan yang terdiri dari sembilan tikungan kekanan dan tujuh tikungan kekiri, dengan tikungan yang menjadi primadona dari sirkuit Shanghai adalah tikungan satu sampai tiga dan tikungan ke-14.  Sirkuit Shanghai mempunyai panjang 5.451 km dengan rekor lap unoffical diciptakan oleh Sebastian Vettel pada tahun 2018 dengan catatan waktu 1:31.091, namun untuk rekor lap saat balapan berlangsung masih dipegang oleh Michael Schumacher yang menorehkannya pada tahun 2004 dengan catatan waktu 1:32.238. Tahun ini menjadi perhelatan ke-15 Sirkuit Shanghai di ajang balap Formula satu. 

Layout dari Shanghai International Circuit
 Preview GP China: Mercedes diatas. Ferrari keatas? Tahun ini perhelatan ajang Formula 1 telah berjalan selama dua seri yang diawali dengan GP Australia pada pertenghan bulan maret lalu dan GP Bahrain yang berlangsung dua minggu lalu, dan dalam dua balapan tersebut tim Mercedes berhasil memenanginya lewat pembalap mereka yaitu Valteri Bottas dan Lewis Hamilton. Pada GP Australia yang lalu Mercedes sangat mendominasi dari awal latihan bebas sampai dengan kemenangan satu-dua mereka, yang menjadi sorotan utama pada GP Australia lalu adalah hilangnya kecepatan Ferrari. Ferrari sangat kesulitan di GP Australia lalu ketika mereka hanya berhasil menyelesaikan balapan di posisi keempat dan kelima dengan jarak yang cukup jauh dengan pemenang balap minggu itu Valteri Bottas. Lalu ketika di GP Bahrain tim Ferrari akhirnya berhasil bangkit. Menguasai dari latihan bebas satu sampai dengan kualifikasi menempati posisi satu dan dua otomatis menempatkan Ferrari menjadi unggulan terdepan untuk memenangkan balapan di GP Bahrain saat itu. Namun sayang harapan itu semua sirna ketika Charles Leclerc mengalami masalah pada mobilnya ketika ia sudah memimpin jalannya balapan dari awal hingga pertengahan balapan sehingga Leclerc harus merelakan posisi satu untuk Lewis Hamilton dan menyelesaikan balapan di posisi ketiga. Rekan setimnya yaitu Sebastian Vettel sendiri yang juga telah setengah jalannya balap dilalui diurutan kedua dibelakang Leclerc harus rela menyelesaikan balapan di posisi kelima ketika dia melakukan kesalahan ketika dia tiba-tiba berputar mobilnya saat sedang berduel dengan Lewis Hamilton untuk perebutan posisi kedua di lap-38. 

Sebastian Vettel mengalami kerusakan sayap depan setelah melakukan kesalahan di lap 38
 Pada GP China saat ini dilihat dari perolehan klasemen pembalap dan konstruktornya. Mercedes saat ini memang sedang memuncaki kedua klasemen tersebut, namun Mercedes tetap tak ingin dilihat sebagai tim atau mobil yang harus dikalahkan tahun ini. Menurut Mercedes tim dan mobil yang harusnya ditakuti dan dijadikan tujuan untuk dikalahkan adalah mobil dari tim Ferrari.  Menurut Toto Wolf yang adalah bos tim Mercedes, jangan lihat Ferrari berdasarkan hasil yang didapat pada dua balapan sebelumnya. Wolf menambahkan jika ditilik dari segi performa mobil, Ferrari berhasil memperlihatkan performa mobil mereka yang sebenarnya saat di GP Bahrain yang lalu. Apalagi jika dilihat dengan karakteristik GP Bahrain dan GP China ini dari segi sirkuit karakteristiknya terbilang sama. Mercedes menggaris bawahi bahwa kecepatan Ferrari di trek luruslah yang menjadi poin terkuat dan ketakutan terbesar Mercedes maupun tim yang lainnya. Memang jika kita lihat betapa dominannya mobil Ferrari di GP Bahrain, bisa disimpulkan untuk hari minggu nanti akan menjadi bukti kembali betapa dominannya mobil Ferrari awal tahun ini. Ditambah dengan performa Charles Leclerc yang sedang sangat baik, bisa menjadi senjata utama Ferrari untuk GP China minggu ini. Pihak Ferrari sendiri sudah mengkonfirmasi masalah di mobil Leclerc dibalapan sebelumnya bukan berasal dari mesin utamanya, dan bisa dikonfirmasi oleh Ferrari juga kalau masalahnya sudah teratasi dan bahkan Leclerc akan tetap menggunakan mesin mobil yang dia pakai saat GP Bahrain. Ini memberikan optimisme Ferrari menjelang GP China minggu ini. Sedangkan untuk Sebastian Vettel, saat ini dia sudah tertinggal 22 poin dengan Valteri Bottas yang adalah pemimpin klasemen pembalap saat ini. Ini menyamai dua balapan awal terburuk Vettel bersama Ferrari sejak tahun 2016 lalu. Vettel ketika ditanya apa yang salah dari dua balapan yang sudah dijalani tahun ini, dia menjawab ""Saya tidak senang dengan performa saya, juga belum senang dengan perasaan dengan mobil, perasaan yang saya miliki dalam tes dan sebagainya. Saya tahu bahwa saya bisa menjadi lebih baik dan saya tahu bahwa kami memiliki banyak seri untuk menunjukkan dan membuktikannya. Tapi setidaknya ketika saya tidak menang, dia (Leclerc) bisa."" Vettel menambahkan, sesi tes di sirkuit Bahrain dua hari setelah GP Bahrain telah membantu dia untuk lebih mengenal karakteristik dari mobil Ferrari yang tahun ini dinamakan Lina oleh Vettel. Menurutnya ini akan menambahkan kepercayaan dirinya dan kepercayaannya kepada mobol Ferrarinya. "
"Elsya/Hendrik Raih Perak, Indonesia Lampaui Target di Bangkok                    ","Oleh : Bert Toar Polii Tim Indonesia yang dipimpin Tim Manager, Paramudita Munandar dengan susunan kontingen sebagai berikut : Girls U26 dengan para pemain,  Fortina Mora Sibuea-Villa Rosa,  Fransisca Tri Martanti-Monica Ayu Triana,  Rachma Shaumi -Roro Joffani Tungga Dewi dan NPC Robert Soeseno Junior U26 yang diperkuat  para pemain,  Elsya Saktia Ningtias-Hendrik Febriyanto,  Thedy Setiawan-Fajar Pangestu dan   Vichenzo Scyvo Alexander Nelwan-Jordy Hristo Moleong dengan Non Playing Captain Syahrial Ali Youngster U21, Indonesia yang turun dengan sponsor Djarum Bridge Club diperkuat oleh para  pemain dari Jawa Tengah, yaitu Dian Kartika Siwi--Rahma Nisa, Salsa Bila Dela Sativa--Dessy Noervita Rahayu dan Octalia Putri Arthamevia--Della Ayu Nobira serta NPC Kusumo Haryayo Tim Kids Manado yang diperkuat para pemain dari Toar Manado Bridge Club asuhan Harke Tulenan dengan para pemain, Angelica PT Rompas--Christofel Katiandagho, Minyeo Jubilate Kairupan--Jaedon Mozez Kairupan dan Whitney Alice Kattang--Taqwa R Winata dengan NPC Jhon Tumewu dan pelatih Yuri GK Luntungan,  berangkat ke Bangkok mengikuti 23rd Asia Pacific Bridge Frderation Championship yang berlangsung di Montien Hotel pada tanggal 5-11 April 2019 dengan target ""naik panggung"" atau meraih medali di nomor Junior U26 dan Girls U26 serta bertanding sebaik-baiknya buat Youngster U21 dan Kids U16 yang berpartisipasi atas biaya sendiri. Target kedua adalah lolos mewakili Zone VI untuk bertanding di The World Youth Team Championship 2020. Namun semangat yang diperlihatkan para pemain hasil seleksi nasional kemudian dibina oleh KPPTN yang dipimpin Laksamana Pertama TNI Teguh Widodo sungguh diluar dugaan membuat target terlampaui bahkan ditambah bonus. Walaupun ditempa di Pelatnas hanya dalam waktu singkat, namun karena semua factor diperhatikan, seperti kesehatan, teknik bridge, kebugaran tubuh, karakter dan lain-lain maka peningkatan dalam banyak hal terlihat dampaknya pada penampilan para pemain. Dengan usaha pantang menyerah dan bermain tenang, Girls U26 meraih medali emas dan Junior U26 berhasil mendapat medali perunggu sekaligus kedua tim ini lolos mewakili Zone VI ke The World Youth Team Championship 2020. Keberhasilan lain adalah lolosnya Kids U16 ke The World Youth Team Championship 2020. Memang mereka lolos karena hanya 4 negara yang ikut berkompetisi, tapi mereka lolos dengan terhormat karena hanya kalah dari China dan berada diatas Hongkong dan tuan rumah Thailand. Tim Youngster U21 memang belum berhasil, namun mereka telah tampil dengan semangat yang tinggi dan berada di peringkat 6 diatas Chinesse Taipei. Bonus lainnya adalah keberhasilan pasangan Elsya Sakti Ningtiyas/Hendrik Febriyanto meraih medali perak pada nomor terakhir yang dipertandingkan, yaitu Match Point (MP) Pairs yang diikuti 115 pasangan. Medali Emas diraih pasangan Liam Dong/Wang Yuyan dari  China dan medali perunggu diraih pasangan So matsumoto/Yoshitake Inoue dari Jepang. Berkat keberhasilan ini, Indonesia berada diperingkat kedua dibawah Jepang dalam perolehan medali di event ini. Hasil perolehan medali :                                       Emas                   Perak         Perunggu . Wakil Zone VI pada The World Youth Team Championship 2020 adalah : Junior U26 Girls U26 Youngster U21 "
Ajax dan Kutukan Klub-klub Kuda Hitam                    ," Penampilan Ajax di musim bisa dibilang fantastis. Betapa tidak, mereka bisa memuncaki klasmen Liga Belanda dan melaju ke babak 8 besar Liga Champions setelah mengalahkan Real Madrid. Lebih hebatnya lagi, tim ini diisi oleh mayoritas anak muda dengan rata-rata usia 22,3 tahun. Kapten mereka, Matthijs De Light, baru berusia 19 dan menjadi kapten termuda di fase grup Liga Champions. Dia juga menjadi pemain termuda (17) yang bermain untuk timnas Belanda sejak 1931. Kehebatan mereka kembali berlanjut seusai menahan imbang Juventus pada kamis dinihari (11/4). Melawan tim sekelas Juventus dengan materi pemain yang jauh lebih berpengalaman, anak-anak muda Ajax berhasil mendominasi pertandingan dengan dengan total penguasaan bola 61%-39%. Mereka juga berhasil melepas 19 tembakan, sedangkan Juventus hanya mampu melepas 7 tembakan. Statistika ini menunjukkan bahwa Ajax tidak bisa dipandang sebelah mata. Pencapaian Ajax ini sebenarnya mirip dengan AS Monaco di musim 2016/2017. Dengan materi pemain yang tidak diunggulkan, Monaco berhasil menjuarai Liga Prancis, mematahkan dominasi PSG yang diisi oleh pemain-pemain mahal. Di Liga Champions, mereka berhasil mencapai babak Semi Final sebelum akhirnya dikalahkan Juventus dengan agregat 4-1. Setelah mengalami musim yang fantastis, beberapa pemain penting Monaco seperti Kylian Mbappe dan Bernardo Silva memilih hengkang. Hasilnya, Monaco terseok-seok di musim berikutnya, baik di kanca domestic maupun Eropa. Jika melihat pengalaman tim-tim kuda hitam di Eropa, Ajax bisa saja bernasib serupa seperti AS Monaco. Pemain-pemainnya akan hengkang setelah menjalani musim hebat dan tanda-tanda itu mulai terlihat. Frenkie De Jong, salah satu pemain kunci Ajax telah bergabung dengan Barcelona di bursa transfer musim dingin lalu. Namun, ia baru akan menandatangani kontrak resminya pada Juli mendatang. Sepertinya, De Jong bukanlah satu-satunya pemain yang akan hengkang di musim depan. Belakangan ini, media santer memberitakan ketertarikan klub-klub besar Eropa terhadap beberapa pemainnya. Seperti De Light yang diminati oleh Juventus, Barcelona, dan MU. Yang terbaru, Liverpool disebut-sebut juga berencana mendatangkannya dengan memanfaatkan Van Dijk dan Wijnaldum yang menjadi kompatriot De Light di timnas Belanda. Selain itu, pemain lain yang mencuri perhatian klub-klub besar adalah Hakim Ziyech. Pemain berkebangsaan Maroko itu sejak musim lalu telah dikaitkan dengan Liverpool, setelah kegagalannya dalam menadatangkan Nabil Fekir dari Lyon. Liverpool diyakini masih menaruh minat kepada Ziyech sebagai pengganti Philippe Coutinho. Nico Tagliafico dan Donny van de Beek adalah dua nama lain yang dalam beberapa waktu terakhir juga dikabarkan menjadi incaran klub lain. Andai semua kemungkinan itu terjadi, kepergian pemain-pemain penting tersebut tentu akan meninggalkan lubang besar dalam skuat Ajax di musim depan. Namun, bukan Ajax jika tidak bisa mengatasi permasalahan itu. Sejarah telah mencatat Ajax sebagai pencetak pemain-pemain kelas dunia. Zlatan Ibrahimovic, Luis Suarez, Wesley Sneijder, Christian Eriksen, dan Jan Vertonghen adalah sebagian kecil dari deretan nama besar jebolan Ajax. Melihat dari pengalaman itu, tampaknya Ajax tidak akan mengalami nasib seburuk Monaco musim lalu. Apa yang terjadi pada Ajax dan Monaco hanya contoh kecil dari nasib tim-tim kuda hitam Eropa. Sulit bagi mereka untuk menyaingi klub-klub besar seperti Juventus, Barcelona dan Real Madrid. Bagi mereka, menjalani musim yang hebat adalah pencapaian besar sekaligus bencana. Mereka tidak bisa berbuat banyak ketika mendapat tawaran uang dalam jumlah besar untuk memboyong pemainnya. Meski mendapat dana segar, seringkali mereka kesulitan untuk mendapatkan pengganti pemain yang telah hengkang karena tidak ada jaminan untuk mengulangi kesuksesan sebelumnya. Klub-klub sekelas Ajax selamanya akan menjadi pemasok pemain-pemain hebat bagi klub-klub besar Eropa. Lemahnya finansial tidak merestui mereka untuk bisa bersaing. Namun, setidaknya klub-klub ini memberi pelajaran bagi kita untuk terus bermimpi meraih kesuksesan dan selalu yakin akan kemampuan yang kita miliki. "
Faktor Gerard Pique dan Rasa Optimis Solskjaer Menatap Laga di Camp Nou Barcelona                    ," Manchester United harus mengakui keunggulan Barcelona dalam laga leg pertama mereka di Old Trafford, Kamis (11/4/19) dini hari WIB. Namun kemenangan 1-0 Barcelona akibat gol bunuh diri dari full back United, Luke Shaw yang memantulkan sundulan Luis Suarez melalui pundaknya masuk ke gawang De Gea. Sebelum laga banyak pengamat mengunggulkan Barcelona dibandingkan Manchester United. Faktanya tidak demikian karena laga berjalan sangat berimbang walaupun penguasaan bola 62 persen didominasi oleh klub asal Catalan ini. Messi memang tidak banyak mengancam gawang De Gea tercatat hanya ada satu tendangannya mengarah ke sana dan umpan akuratnya yang dimanfaatkan Suarez menjadi gol bunuh dirinya Luke Shaw di menit ke-12 tersebut (UEFA.com 11/4/19).   Solskjaer sendiri terlihat tidak terlalu kecewa dengan kekalahan ini. Malah dia memuji performa pemainnya. Kita simak komentarnya tentang Rashford dan Martial seperti dilansir UEFA.com (11/4/19), Solskjaer mengatakan : ""Anda dapat melihat dia adalah pemain yang fantastis tekniknya. Malam ini bukan malam kami dan kami tidak mencapai target. Itu mengecewakan karena Rashford memiliki peluang dan Martial lolos pada akhirnya. Biasanya dalam latihan ia mengambil sentuhan dan menusuk ke dalam."" Melakukan evaluasi menyeluruh untuk menghadapi laga di Nou Camp. Salah satu yang dilakukan Solskjaer adalah harus memperlambat permainan. Dia baru menyadari terlalu cepat untuk memberikan bola lebih awal. Solskjaer juga berpikir bahwa mereka, Barcelona akan waspada dengan apa yang pernah dilakukan United saat mengalahkan PSG di Paris. United juga menciptakan dua peluang sangat bagus namun tidak mampu dijadikan gol. Hal seperti ini harus bisa dimanfaatkan dengan sangat efektif dan efisien ketika United bermain di Nou Camp Barcelona. Menyikapi hasil malam itu di Old Trafford, kepada Manutd.com (11/4/19), Solskjaer mengatakan : ""Ada positif dan negatif. Saya pikir kami mulai ceroboh dan kami agak gugup pada awal laga. Kami tidak benar-benar mendapatkan tekanan pada mereka. Setelah gol mereka, kami sedikit tenang dan kami bermain bagus. Kami juga memiliki beberapa penampilan yang sangat bagus dari beberapa individu, di lini tengah - saya pikir mereka melakukannya dengan sangat baik."" Namun sebaiknya Solskjaer harus juga menyadari bahwa sosok Gerard Pique adalah sosok penting di lini belakang Barcelona. Dia adalah mantan punggawa lini belakang Manchester United sehingga paham benar dengan karakter serangan Setan Merah. Dari saat pertama ia ditekan untuk melayani Rashford, pada kesempatan itu, Piqu tahu ia seperti berada di rumah sendiri. Ya Old Trafford adalah tempat di mana ia ""tumbuh"" dan tidak hanya membuat dampak besar dengan kepribadiannya, tetapi juga kemajuan karirnya dengan dukungan Rio Ferdiand dan Nemanja Vidi. Maka sangat wajar jika malam itu Pique bermain tenang sepanjang laga. Selalu menang dalam duel udara, memiliki ketenangan di tengah-tengah serangan badai merah seorang Rashford dan Lukaku. Demikian pula tantangan akhir menghadapi Anthony Martial, Piqu memberikan kinerja yang khas yaitu keanggunan dan tekad. Seharusnya Solskjaer mulai memperhatikan factor Gerard Pique ini saat United bermain di Nou Camp pada leg kedua, Rabu (17/4/19) pukul 02.00 WIB. Malam itu Pique seolah memberikan pesan yang khas kepada punggawa Manchester United. Pesan yang berisi bahwa dia tahu segalanya dengan dapur Setan Merah. "
Pemain Lapis Kedua Indonesia Tampil di Ciputra Hanoi-Yonex Sunrise Vietnam International Challenge 2019                    ,"                                                                                                                       (Dokumentasi: www.bulutangkis.com) Dalam waktu yang bersamaan, Indonesia berpartisipasi dalam dua turnamen bulutangkis di belahan Asia. Kedua turnamen yang diikuti tersebut adalah turnamen Singapore Open 2019 di kota Singapura, Singapura dan Ciputra Hanoi-Yonex Sunrise Vietnam International Challenge 2019 di kota Hanoi, Vietnam yang sama-sama diselenggarakan dari tanggal 9 s/d 14 April 2019. Pemain yang diturunkan untuk turnamen level International Challenge di Vietnam sebagian besar pemain lapis kedua yang merupakan gabungan pemain pelatnas utama, magang pelatnas utama, pelatnas pratama, magang pelatnas pratama, dan non pelatnas. Dalam turnamen ini, Indonesia mengikutsertakan 26 wakilnya yang terdiri dari 11 pemain sektor tunggal putra, 3 pemain tunggal putri, 7 pasangan sektor ganda putra, 2 pasangan sektor ganda putri, dan sektor ganda campuran yang mengirimkan 3 wakilnya. Berdasarkan daftar unggulan pemain, pemain Indonesia yang berpeluang besar untuk tampil sebagai juara adalah Dinar Dyah Ayustine, pemain non pelatnas yang diunggulkan di posisi pertama sektor tunggal putri. Pemain Indonesia lainnya yang diunggulkan adalah Firman Abdul Kholik, pemain magang pelatnas utama yang diunggulkan di posisi kedua sektor tunggal putra. Chico Aura Dwi Wardoyo, pemain pelatnas utama yang diunggulkan di posisi keempat sektor tunggal putra. Ikhsan Leonardo Imanuel Rumbay, pemain pelatnas utama yang diunggulkan di posisi ke 16 sektor tunggal putra. Kenas Adi Haryanto/Rian Agung Saputro, pasangan non pelatnas yang diunggulkan di posisi keenam sektor ganda putra. Nita Violina Marwah/Putri Syaikah Ulima Hidayat, pasangan pelatnas pratama yang diunggulkan di posisi kelima sektor ganda putri. Zachariah Josiahno Sumanti/Angelica Wiratama, pasangan kombinasi magang pelatnas pratama dengan pelatnas pratama yang diunggulkan di posisi keempat sektor ganda campuran. Dalam turnamen ini, sebagian pemain Indonesia harus melalui babak kualifikasi, kecuali sektor ganda campuran. Melewati babak kualifikasi, di sektor tunggal putra dari 5 pemain yang diturunkan, empat diantaranya lolos ke babak utama yaitu Iqbal Aji Tri Pamungkas menang dua set langsung atas pemain Thailand Panitchaphon Teeraratsakul dengan skor 21-14  21-10. Kemudian menyusul Muhammad Febriansyah yang mengalahkan pemain India Thejas Shivakumar dua set langsung dengan skor 21-14 dan 21-16. Nyoman Tryadnya Arya Kurniawan yang mengalahkan pemain Thailand Chaiyasit Sukasem dua set langsung dengan skor 21-14  21-14. Selanjutnya Alberto Alvin Yulianto setelah menang dua set langsung atas pemain Malaysia Chuan Zhe Tai dengan skor 21-14  21-15. Satu-satunya pemain tunggal putra Indonesia yang mengalami kekalahan di babak kualifikasi adalah Alden Lefilson Putra Mainaky yang langsung tersisih pada pertandingan pertama setelah dikalahkan oleh pemain Taiwan Hua Chun Liang dengan dua game langsung dengan skor 13-21 dan 13-21. Berikutnya sektor tunggal putri, satu dari dua tunggal putri yang diturunkan lolos ke babak utama. Sri Fatmawati menang dua set langsung atas pemain Malaysia Lee Zii Yii dengan skor 21-11  21-19. Sementara itu Asty Dwi Widyaningrum langsung tersisih pada pertandingan pertama setelah dikalahkan oleh pemain Thailand Benyapa Aimsaard dua game langsung dengan skor 19-21 dan 16-21. Selanjutnya di sektor ganda putra, dua dari empat pasangan yang diturunkan Indonesia berhasil lolos ke babak utama. Pasangan Syahrizal Dafandi Arafixqli/Syahrozi Dafandi Arafixqli menjadi pembuka lolos ke babak utama setelah menang telak dua set langsung atas pasangan Thailand Peeratchai Sukphun/Pakkapon Teeraratsakul dengan skor 21-10  21-8. Diikuti pasangan Adnan Maulana/Ghifari Anandaffa Prihardika yang menang dua set langsung atas pasangan gado-gado Canada dan Inggris Jeffrey Lam/Hin Shin Wong dengan skor 21-7  21-9. Sementara itu pasangan Lukhi Apri Nugroho/Agripinna Prima Rahmanto Putra langsung tersisih pada pertandingan pertama setelah dikalahkan oleh pasangan Hongkong Chung Yonny/Or Chin Chung dua game langsung dengan skor 17-21 dan 18-21. Pasangan Alweyn Jantje Putra Mainaky/Yehezkiel Fritz Mainaky dikalahkan oleh pasangan Taiwan Chang En Chia/Chen Xin-Yuan dua game langsung dengan skor 10-21 dan 18-21. Di sektor ganda putri, satu-satunya pasangan ganda putri yang harus melewati babak kualifikasi, gagal melewatinya. Febby Valencia Dwijayanti Gani/Rayhan Vania Salsabila dikalahkan oleh pasangan Malaysia Rui Chen Yap/Yee Yap dua game langsung dengan skor 13-21 dan 18-21. "
Ngomongin Liga Champions (Lagi)                    ," Menit kesepuluh adalah waktu pertandingan berjalan saat dini hari tadi kunyalakan televisi, televisi lokal yang nayangin MU vs Barcelona, skor masih 0-0, dalam hati mbatin.., lumayan belum kebobolan dalam sepuluh menit lawan Barca yang ada Lionel Messi-nya. Dan oh.., tak lama kemudian tiba-tiba sundulan Suarez masuk ke gawang, hakim garis mengangkat bendera.., asyik offset.., eh tapi..tapi, ini bukan Premier league euy.., ada VAR.., dan bener diVARkan dan jadi gol, gol bunuh diri Luke Shaw ternyata..., selang beberapa detik ada tetangga sebelah ngirim japri : #kamisukaVAR Setelah itu, MU main pressing yang lumayan ketat di pertahanan Barca, dan beberapa kali membuat bek-bek Barca hampir ngelawak, tapi penyerang-penyerang MU juga gak kalah nglawaknya, 10 kali shoot tanpa satupun yang tepat sasaran. Tapi ya lumayan, setidaknya bisa membuat 10 shoot lawan Barca yang ada Lionel Messi-nya... Sampai akhir pertandingan MU kalah 0-1, di kandang. Sebagai pendukung MU ya kecewa jelas, tapi ya gak kecewa-kecewa amat, mainnya gak jelek-jelek amat, kemaren lawan PSG juga kalah di kandang duluan dan bisa comeback syahdu di Paris, di menit akhir dengan penalti hasil handsball.., ah ketika itu sungguh, kami sangat suka VAR, sungguh-sungguh suka bahkan... Di pertandingan sebelah, Juventus yang ada Cristiano Ronaldo-nya ditahan Ajax 1-1 , Ajax menguasai pertandingan dengan penguasaan bola 61% , dengan shoot 19 kali (6 on target) dibandingkan Juve yang hanya 7 shoot (1 doang yang on target, jadi gol pula). Ronaldo kembali mencetak gol di fase knockout Liga Champions Jadi, Messi timnya menang tapi tidak bikin gol, sedangkan Ronaldo bikin gol tapi timnya tidak menang. Bahan baku yang asyik buat mereka yang suka gontok-gontokan meributkan segala hal... "
