"Persija Gagal Balas Dendam, Takluk 2-3 dari Ceres Negros                    ","Setelah keberhasilan PSM Makassar mengalahkan Klub Kaya FC di Filipina Rabu (17/4/2019) lalu, hari ini (23/4/2019) giliran Persija yang menjamu wakil Filipina lainnya, Ceres Negros di Gelora Bung Karno (GBK), Jakarta.  Sama dengan Filipina, Indonesia dapat jatah dua klub pada turnamen Piala AFC 2019, yang diberikan pada Persija dan PSM sebagai juara dan runner up Liga 1 2018. Pada laga leg pertama sekitar dua minggu sebelumnya, Persija kalah 0-1 saat bertandang ke markas Ceres Negros di Filipina. Maka tentu saja kesempatan di depan puluhan ribu Jakmania yang memenuhi GBK menjadi momen yang pas bagi anak-anak ""Macan Kemayoran"" ini untuk membalas dendam. Namun sayang, ada ketidak jelasan terkait boleh tidaknya Jakmania menonton laga penting tersebut. Berita yang beredar beberapa jam sebelum pertandingan, pihak kepolisian tidak mengizinkan laga di GBK dihadiri penonton secara langsung.  Padahal panitia telah menual tiket pertandingan sebanyak 60.000 lembar. Kepolisian meminta pengertian Jakmania atas keputusan tersebut dan panitia akan mengembalikan uang pembelian tiket yang sudah dibayar penonton. Alasan kepolisian dikabarkan karena masih fokus pada pengamanan perhitungan suara pemilu serentak. Mungkin karena larangan yang sangat mendadak, siang hari Jakmania sudah terlanjur berdatangan ke GBK. Akhirnya setelah berdiskusi dengan panitia, polisi mengizinkan penonton yang telah memegang tiket untuk masuk stadion. Persija memulai laga dengan permainan yang agresif, lebih banyak melakukan serangan. Pada menit 21 wasit memberi hadiah penalti untuk Persija setelah Sandi Sute dijatuhkan pemain Ceres di kotak terlarang.  Sayang, tendangan Bruno Matos yang mengeksekusi penalti gagal berbuah gol. Bruno menendang terlalu pelan sehingga mampu dihadang penjaga gawang Ceres. Pada babak kedua, Persija seperti akan memenangkan laga karena sempat memimpin 2-0 terlebih dahulu. Gol pertama tercipta pada menit 49 melalui sundulan Sandi Sute menyambut tendangan bebas Ismed Sofyan. Persija makin di atas angin setelah Bruno Matos terlepas dari kawalan pemain belakang Ceres saat menerima umpan matang dari Novri Setiawan. Sambil berlari, tendangan Bruno bersarang di gawang Ceres pada menit 57. Unggul 2-0 membuat Persija ingin bermain aman dengan lebih memperkuat pertahanan. Justru inilah awal petaka karena postur tubuh rata-rata pemain Ceres yang tinggi sulit dikawal, apalagi mendekati akhir laga stamina pemain Persija mulai kedodoran. Gol balasan Ceres dimulai oleh tendangan jarak jauh Miguel Tranton pada menit 70 yang mengecoh penjaga gawang Persija, Andritany. Berikutnya pada menit 85 dari sundulan Maranon. Sepakan voli Manuel Ott pada masa tambahan waktu memastikan kemenangan Ceres Negros dengan skor 3-2. Ceres semakin kokoh di puncak klasemen sementara grup G, diikuti klub Binh Duong dari Vietnam. Persija yang tak beranjak dari posisi ketiga, peluangnya semakin tipis untuk melaju ke babak berikutnya. Peluang klub asal Indonesia yang masih terbuka lebar dimiliki PSM yang sementara ini masih memimpin di grup H.  "
Gamer: Aku Juga Bisa Berprestasi dan Ingin di Apresiasi                    ,"Tuhan menganugrahi setiap individu dengan kemampuan yang berbeda-beda, kecerdasan tidak hanya berhubungan dengan matematis karena setiap manusia dilahirkan dengan kecerdasannya masing-masing. Pendidikan memang sangat penting untuk mengembangkan potensi dan bakat, tapi sekiranya para tenaga pendidik atau instansi pendidikan harus mengerti dan memahami tingkat kemampuan anak didiknya. Perbedaan latar belakang keluarga, minat dan bakat mengakibatkan perbedaan kecepatan belajar atau pemahaman tentang sesuatu yang berakibat terhadap keberhasilan yang dicapai. Oleh karena itu, tidak bisa dipukul rata kemampuan individu satu dengan individu lainnya. Kecerdasan individu tergantung  pada konteks, kecerdasan yang di dapatkan dari sekolah bersifat terbatas karena hanya individu tertentu saja yang dapat menguasai kemampuan tersebut dan sisanya hanya mengikuti proses pembelajaran. Sesungguhnya ada aspek kecerdasan yang lebih luas lagi, tidak hanya berhubungan tentang matematis seperti persepsi kebanyakan orang bahwa yang cerdas itu harus pintar matematika. Seperti yang di sebutkan dalam buku 7 Kind Of Smart karya Thomas Armstrong, dia menyimpulkan bahwa dalam diri manusia terdapat potensi 7 kecerdasan. Kecerdasan tersebut antara lain yaitu: kecerdasan linguistik, kecerdasan logika atau matematis, kecerdasan spasial, kecerdasan musikal, kecerdasan kinestik-jasmani, kecerdasan antar pribadi, dan kecerdasan intrapribadi. Tidak semua orang bisa menguasai kecerdasan tersebut, umumnya orang akan menonjolkan satu kecerdasan saja sementara kecerdasan yang lainnya melemah. Namun apapun kecerdasan yang kita tonjolkan dari dalam diri kita, kita mempunyai hak untuk disebut cerdas.  Seiring dengan perkembangan zaman dan teknologi yang begitu pesat, mengakibatkan komunikasi antar umat manusia lebih mudah dengan menggunakan  sarana prasarana yang ada. Game Online adalah salah satu sarana untuk menghilangkan rasa bosan, menghilangkan stress dan banyak lagi manfaat lainnya. Bermain game online semakin menyenangkan, mulai dari variasi game, tampilan, grafis, resolusi gambar dan lain sebagainya, sehingga membuat banyak orang candu akan hal tersebut. Ada banyak game online yang bisa di mainkan bahkan banyak diantara game tersebut menerbitkan versi mobilenya seperti PUBG Mobile, Free Fire, Mobile lagends dan banyak lagi game online lainnya.Akhir-akhir ini game online menjadi perbincangan banyak orang, persepsi kebanyakan orang menganggap game online menimbulkan dampak yang sangat buruk tanpa melihat sisi baiknya. Faktanya segala sesuatu jika dilakukan dengan berlebihan efeknya pasti tidak baik, begitupun dengan bermain game online. Para gamers bisa merais rejeki dengan bermain game online yang dimainkan entah itu menjadi konten kreator atau bisa menjadi atlet eSport, tidak menutup kemungkinan itu bisa menjadi usaha yang menarik, bermain dan mendapatkan uang. Menjadi atlet eSport merupakan impian banyak gamer, karena banyak sekali event-event yang diadakan untuk melihat kemapuan para pemain baik tingkat lokal maupun international.  Salah satu contohnya pada tanggal 7 April 2019 kemarin garena untuk pertama kalinya mengadakan kejuaraan dunia untuk gim battle royale yang bertempat di BITEC Bangna Exhibition Center Bangkok, Thailand. Pada ajang tersebut 12 team terbaik dari seluruh dunia dipertemukan, untuk merebutkan hadiah ratusan juta rupiah dan gelar juara dunia. Indonesia sendiri mengirim dua team untuk berlaga diajang tersebut yaitu; Capital eSport dan SFI Zet Hades, team dengan poin terbanyak otomatis menjadi pemenang dan meraih title ''Juara Dunia Free fire"". Alhasil team perwakilan Indonesia meraih peringkat pertama dan ketiga dimana peringkat pertama diaraih oleh team Capital eSport dan peringkat ketiga diraih oleh SFI Zet Hades. Bagaimanapun kita harus mengapresiasi hal tersebut karena telah membawa nama Indonesia, karena untuk menempati peringkat pertama dan ketiga membutuhkan latihan yang sangat extra dan tekad yang kuat.Itu merupakan salah satu contoh dan banyak lagi contoh lainnya yang bisa kita banggakan, disini penulis juga ingin menyampaikan bahwa bermain game online juga memiliki banyak dampak positif. Saat bermain game kita diajarkan untuk menyusun strategi dalam menyelsaikan misi dan itu membutuhkan keterampilan yang bagus, dan satu hal yang sangat penting adalah dengan bermain game online tertentu kita diajarkan untuk bagaimana caranya berorganisasai dimana jika pemain sudah terikat dengan satu guild secara tidak langsung akan melatih pemain untuk terus berkembang menjadi lebih baik. Game online dapat mempererat tali persaudaraan, karena disaat dalam permaianan pemainr akan bertemu lawan atau kawan dari berbagai wilayah yang bisa diajak untuk berkomunikasi, pada dasarnya jika memiliki ketertarikan yang sama maka tali pertemanan akan mudah terjalin. Itulah beberapa manfaat dari bermain game online tanpa  disadari, intinya saat bermain game jangan terlalu mengorbankan banyak waktumu karena masih banyak kegiatan yang diluar sana menantimu, begitupun sebaliknya kamu bisa menjadikan hobimu tersebut untuk mencari penghasilan lebih.Jago dalam hal tersebut juga merupakan kecerdasan yang tidak bisa dimiliki oleh semua orang, oleh karena itu gamers juga manusia yang ingin diapresiasi atas kemampuan bermainnya. #SalamBooyaahdariGuildImmortal.IDFreefire "
Aktor Men In Black dan Eks Pemain AC Milan Danai Esports                    ,"Organisasi esports dunia Gen.G mengumumkan telah mendapatkan suntikan dana investasi senilai 46 juta USD dari Dreamers Fund. Dreamers Fund adalah organisasi yang memfokuskan bantuan pendanaan bagi anak-anak muda. Kali ini mereka mendukung ekspansi dari Gen.G untuk mengembangkan potensi anak-anak muda dalam berprestasi. Beberapa di antara para penyumbang dana dari Dreamers Fund adalah aktor film laga Will Smithyang dikenal sebagai pemeran Agent J di film Man In Black. Selain sang aktor kawakan, ada pula sumbangsih pesepakbola Keisuke Honda yang pernah merumput bersama AC Milan. Adapun alasan dari Honda untuk mendanai Gen.G karena, ""Gen.G adalah tim yang luar biasa dan visi utama mereka yakni menjadi yang terdepan di ranah ini."" Gen.G sendiri merupakan organisasi esports yang berasal dari Korea. Saat ini, Gen.G telah merambah kompetisi esports di Amerika Utara dan Cina dengan lima divisi andalannya di cabang Overwatch, PUBG, League of Legends, Call of Duty, dan Clash Royale. Selain itu, pendanaan Dreamers Fund akan membantu pembangunan sarana untuk Gen.G Youth Esports Academy, serta peresmian markas terbaru mereka di Los Angeles yang bakal dibuka 19 Juli mendatang. Will Smith Ikut Danai Tim Esports "
"Lalu Muhammad Zohri, Manusia Tercepat di Asia Tenggara                    ","Sprinter muda asal Pulau Lombok, Nusa Tenggara Barat, Lalu Muhammad Zohri, semakin mengukuhkan dirinya menjadi manusia tercepat di tanah air, bahkan juga untuk level Asia Tenggara, setelah ia mampu memecahkan rekor nomor paling bergengsi pada cabang olahraga atletik, lari 100 meter putra. Zohri mencatat waktu 10,15 detik pada babak semi final Kejuaraan Atelik Asia 2019 yang berlangsung di Doha, Qatar, Senin (22/4/2019). Catatan waktu tersebut sekaligus menjadi rekor baru nasional yang sebelumnya menjadi milik pelari Suryo Agung Wibowo yang dicetak pada tahun 2009 dengan waktu 10,17 detik. Suryo mencetak rekor saat berlomba di SEA Games Laos dan sekaligus juga menjadi rekor Asia Tenggara. Namun Zohri mempertajam lagi rekornya pada babak final yang berlangsung beberapa jam setelah babak semi final, dengan mencatat waktu 10,13 detik. Zohri menyabet medali perak, di bawah pelari Jepang Kiryu Yoshihide yang meraih medali emas dengan waktu 10,10 detik, dan unggul atas pelari Tiongkok Zhiqiang Wu yang merebut medali perunggu dengan waktu 10,18 detik. Remaja yang belum genap berusia 19 tahun ini melejit namanya setelah meraih medali emas pada Kejuaraan Atletik Dunia tingkat Junior yang berlangsung di Finlandia, 11 Juli 2018 dengan catatan waktu 10,18 detik, mengalahkan dua orang pelari asal Amerika Serikat yang menduduki peringkat kedua dan ketiga. Waktu itu Zohri dan official Indonesia tampaknya tidak menduga bakal mendapat medali emas, sehingga kebingungan mencari bendera merah putih buat dipakai pada selebrasi kemenangan. Namun kehidupan Zohri yang berasal dari keluarga nelayan yang sederhana, setelah itu berubah total. Sambutan dan berbagai hadiah yang diterimanya, termasuk dari Presiden Joko Widodo, sempat dikhawatirkan akan membuat Zohri terlena. Memang, akhirnya waktu tampil di Asian Games, Agustus 2018, pada nomor 100 meter perorangan, Zohri hanya mampu menempati peringkat 7 dengan waktu 10,20 detik, masih di bawah waktu yang ditorehkannya di Finlandia. Untungnya Zohri yang juga turun di nomor estafet 4X100 meter, bersama tiga pelari Indonesia lainnya berhasil menyumbangkan medali perak. Setelah beberapa bulan senyap dari publikasi yang membuat Zohri bisa berkonsentrasi mengasah kemampuannya, alhamdulillah Zohri kembali ke jalur kemenangan, sehingga mampu menjadi manusia tercepat di Asia Tenggara. Mengingat usianya yang masih muda, Zohri diharapkan masih mampu mempertajam rekornya lagi serta semakin mengharumkan nama Indonesia pada berbagai event atletik berskala Asia dan dunia.  "
Burnley Sukses Tahan Imbang Chelsea 2-2                    ,"       Dari lanjutan Premier League 2018/2019 matchday 35 , Chelsea harus puas bermain imbang 2-2 saat hadapi lawannya Burnley di Stamford Bridge yang berlangsung dinihari tadi . Gol dari pemain Chelsea berhasil dicetak oleh N'Golo Kante dan Gonzalo Higuain serta gol balasan Burnley berhasil dicetak oleh Jeff Hendrick dan Ashley Barnes , dan dengan hasil ini membuat Chelsea sementara berada di posisi empat klasemen sementara dengan 67 poin dan Burnley ada diposisi 15 dengan 40 poin . Dan , persaingan menuju zona UEFA Champions League atau Liga Champions Eropa untuk musim depan 2019/2020 menjadi lebih menarik , karena ada Tottenham Hotspur diposisi ketiga dengan nilai 67 yang kemarin kalah dari Manchester City dan akan kembali bertanding selasa malam atau rabu dinihari WIB saat hadapi lawannya Brighton & Hove Albion . Serta diposisi kelima ada Arsenal dengan nilai 66 poin yang sebelumnya juga kalah dari Crystal Palace dimarkas sendiri di Emirates Stadium dan Arsenal akan kembali bertanding saat hadapi lawannya Wolverhampton Wanderers pada rabu malam atau kamis dinihari WIB lusa . Satu tim lagi yaitu Manchester United , ya Manchester United saat ini berada di posisi keenam dengan nilai 64 poin . Setelah kalah telak dari Everton , pasukan Ole Gunnar Solskjaer ini akan kembali bertanding saat hadapi lawannya Manchester City dalam laga bertajuk Manchester Derby .  Tentu saja ini akan menjadi duel sengit antara kedua tim , pasalnya disisi lain Manchester City pun mengincar poin penuh untuk tetap menjaga kans juara Premier League Liga Inggris musim ini dan peluang juara tetap terbuka dan saat ini pasukan Pep Guardiola berada di posisi kedua dengan nilai 86 poin sementara diposisi pertama puncak klasemen sementara ditempati oleh Liverpool dengan nilai 88 poin . Menarik untuk ditunggu sampai akhir musim dan siapakah yang berhak meraih gelar juara ? Dan tim manakah yang layak masuk ke zona UEFA Champions League atau Liga Champions Eropa untuk musim depan ? Kita nantikan bersama . Demikian saya Irfan Maulana terima kasih dan salam olahraga . "
"Saatnya Akhiri ""Paceklik Gelar"" di Kejuaraan Bulutangkis Asia                    ","Pekan ini, Badminton Asia Championship 2019 alias Kejuaraan Bulutangkis Asia, akan digejar di Kota Wuhan, Tiongkok. Kejuaraan bulutangkis perorangan level tertinggi di benua Asia yang digelar tahunan ini akan dimulai 23 April hingga 28 April mendatang. Hampir semua pebulutangkis top Asia akan tampil demi memperebutkan predikat sebagai pebulutangkis terbaik Asia di 2019. Indonesia melalui PBSI mengirimkan 20 pemain/pasangan yang akan tampil di lima nomor yang di pertandingkan, masing-masing empat wakil di sektor tunggal putra/putri, ganda putra/putri dan ganda campuran. Kepada mereka, harapan untuk mengakhiri paceklik gelar di Kejuaraan Bulutangkis Asia, disematkan. Ya, dari tahun ke tahun, Badminton Asia Championship (BAC) memang bukan kejuaraan yang 'ramah' bagi pemain-pemain Indonesia. Faktanya, pemain-pemain Indonesia tak pernah mampu meraih gelar dalam empat penyelenggaraan terakhir. Gelar juara Kejuaraan Asia terakhir kali diraih pada 2015 silam lewat pasangan ganda campuran, Tontowi Ahmad/Liliyana Natsir yang sudah pensiun. Malah, di empat nomor lainnya, paceklik gelar semakin panjang. Ambil contoh di tunggal putra, sudah 12 tahun Indonesia tak pernah juara setelah Taufik Hidayat meraihnya pada 2007 silam. Begitu juga di sektor ganda putra, tahun ini memasuki 10 tahun sejak Hendra Setiawa/Markis Kido juara pada 2009 silam. Bagaimana kali ini?Merujuk pada penampilan terkini di dua turnamen BWF World Tour yang digelar selama April ini yakni di Malaysia Open dan Singapore Open, sektor tunggal putra yang diwakili empat pemain, yakni Anthony Sinisuka Ginting, Tommy Sugiarto, Jonatan Christie, dan Shesar Hiren Rhustavito berpeluang meraih gelar. Merujuk pada penampilan di dua turnamen itu pada dua pekan lalu, Ginting dan Jojo akan bisa melangkah jauh bila mampu tampil konsisten. Di Singapore Open, Ginting bisa mengalahkan Chen Long dan Chou Tien Chen sebelum kalah dari Momota di final. Ketiganya merupakan unggulan utama di Kejuaraan Asia 2019. Sementara Jonatan bisa mengalahkan Momota di Malaysia Open sebelum kalah dari Chen Long di semifinal. Ah, semoga mereka bisa tampil konsisten. Sementara di sektor tunggal putri, menarik ditunggu bagaimana hasil polesan pelatih baru, Rionny Mainaky. Dengan pengalaman melatih Jepang dan telah berhasil mengorbitkan tunggal putri Jepang ke level atas dunia, Rionny yang melatih sejak awal April, diharapkan bisa membawa tunggal putri Indonesia berprestasi bagus. Memang, trio andalan Indonesia, Fitriani, Gregoria Mariska dan Ruselli, belum mampu melangkah jauh di Malaysia Open dan Singapore. Namun, semuanya tentu butuh proses. Saya tertarik membaca komentar Fitriani ketika diwawancara oleh badmintonindonesia.org dalam persiapan menuju BAC 2019. Fitriani menyebut bahwa Rionny pelatih disiplin dan tegas. Dia juga menyebut Rionny menyisipkan latihan fisik selain teknik. Pecinta bulutangkis pastinya paham, bahwa kendala fisik inilah yang acapkali menjadi kendala terbesar bagi tunggal putri Indonesia. Mereka acapkali ""kehabisan bensin"" ketika harus bermain rubber game.  ""Targetnya memang meningkatkan kekuatan fisik kami. Saya mau dapat hasil maksimal di turnamen ini,"" ujar Fitriani. Marcus/Kevin memburu gelar perdana di Kejuaraan AsiaPeluang meraih gelar juga ada di sektor ganda putra. Pasalnya, Indonesia menurunkan empat pasangan terbaiknya. Yakni Marcus Gideon/Kevin Sanjaya, Hendra Setiawan/Mohammad Ahsan dan Fajar Alfian/Muhammad Rian Ardianto yang ketiganya kini masuk peringkat tujuh besar dalam rangking dunia. Selain ketiganya, masih ada pasangan Wahyu Nayaka/Ade Yusuf. Khusus bagi Marcus/Kevin, ganda putra rangking 1 dunia ini akan memburu gelar pertama di Kejuaraan Asia. Marcus/Kevin memang belum pernah jadi juara di kejuaraan ini. Di dua edisi terakhir BAC, yakni tahun 2017 dan 2018, Marcus/Kevin tidak ikut berpartisipasi. Mereka sekali tampil di Kejuaraan Asia, yakni di tahun 2016 dan terhenti di perempat final. 

Marcus Gideon/Kevin Sanjaya/Foto: Twitter Badminton Ina
Kejuaraan Bulutangkis Asia juga akan menjadi kesempatan bagi Marcus/Kevin untuk bangkit setelah tiga kegagalan beruntun di All England, Malaysia Open dan Singapore Open. Pelatih ganda putra PBSI, Herry Imam Pierngadi mengaku tidak khawatir dengan penampilan Marcus/Kevin, meski dia menyebut harus ada evaluasi di mana kekurangannya. ""Saya sudah minta tim Litbang meneliti, lose poin nya di mana, banyak kesalahannya di mana. Ini untuk evaluasi ke depan,"" ujar Herry IP dikutip dari badmintonindonesia.org. Sementara di sektor ganda putri, sudah 23 tahun paceklik gelar berlangsung sejak Eliza Nathanael/ Finarsih memenanginya pada 1996 silam. Kepada empat pasangan, Greysia Polii/Apriani Rahayu, Della Destiara/Rizki Amelia, Yulfira Barkah/Jauza Fadhilla Sugiarto dan Siti Fadia/Agatha Imanuela, digantungkan harapan untuk meraih gelar. Meski, mereka harus bersaing dengan ganda putri Jepang yang menguasai sektor ini dalam tiga tahun terakhir BAC. Juga ganda putri TiIongkok yang pernah 10 tahun beruntun juara pada 2006-2015. Sementara di ganda campuran, semoga saja gelar terakhir lewat Tontowi Ahmad/Liliyana Natsir, bisa menginspirasi empat pasangan ganda campuran Indonesia untuk tampil oke di BAC tahun ini. Empat pasangan tersebut yakni Hafiz Faizal/Gloria Widjaja, Praveen Jordan/Melati Daeva, Rinov Rivaldy/Pitha Mentari dan Alfian Eko Prasetya/Marseilla Gischa. Penampilan ganda campuran Indonesia dalam beberapa turnamen BWF terakhir sebenarnya memperlihatkan progres. Meski, mereka masih belum menemukan cara untuk mengalahkan dua ganda campuran Tiongkok, Zheng Siwei/Huang Yaqiong dan Wang Yilu/Huang Dongping yang menjadi unggulan teratas di kejuaraan ini.  "
Apa yang Harus Dilakukan Solskjaer Setelah Malapetaka di Goodison Park?                    ," Memang Ole Gunnar Solskjaer telah meminta maaf kepada suporter Manchester United setelah kekalahan memalukan 4-0 atas Everton, Minggu (21/4/19). Permintaan maaf yang sangat layak dilakukan oleh Manajer sebagai cermin rasa tanggung jawab dari performa pemain mereka yang jeblok.   Malam itu dalam waktu 25 menit saja, United sudah kebobolan 2 gol. Sebuah tendangan voli akrobatik dari Richarlison membuat Everton unggul di menit ke-12 dan tuan rumah unggul 2-0 di paruh waktu berkat drive 25 meter dari Gylfi Sigurdsson pada menit ke-28. Cukup mengherankan performa David De Gea dengan dua gol ini mengingat tendangan pemain Everton tersebut tidak begitu sulit sebenarnya untuk dihalau oleh Kiper sekaliber dirinya. Pada babak kedua United bukan semakin bangkit menyamakan kedudukan tapi malah semakin terpuruk kebobolan lagi 2 gol. Lucas Digne mencetak gol ketiga menit ke-56  dan Theo Walcott berlari cepat untuk menyelesaikan skor di menit ke-64. Everton unggul 4-0 atas Manchester United. Menurut Premierleague.com (21/4/19), malam itu gol gol yang dicetak oleh Richarlison, Gylfi Sigurdsson, Lucas Digne, dan Theo Walcott seakan sudah mengutuk tim asuhan Solskjaer ini mengalami  kekalahan lima laga tandang secara berturut-turut di semua kompetisi untuk pertama kalinya sejak Maret 1981. Solskjaer mengakui dengan jujur bahwa tim asuhannya tampil sangat buruk. Lini belakang yang rapuh termasuk performa De Gea yang jauh dari kualitas sebenarnya. Paul Pogba bermain sesuka yang dia inginkan tanpa pola yang jelas. Marcus Rashford kehilangan spiritnya untuk mencetak gol. ""Segala sesuatunya salah hari ini. Kami harus mengangkat tangan dan meminta maaf atas nama klub kepada para penggemar karena merekalah satu-satunya yang memiliki lencana yang dapat mengangkat kepala dan mengatakan bahwa mereka adalah Manchester United."" Demikian kata Ole Gunnar Solskjaer kepada Skysports.com (21/4/19). Berbeda dengan Solkjaer, komentar Gary Neville mantan pemain dan Kapten Manchester United ini sangat pedas. Kepada Skysports.com (21/4/19) Gary Neville mengatakan: ""Saya sangat marah, jujur dengan Anda. Saya sudah sering mengatakan tentang klub dalam tujuh tahun terakhir. Jika Anda memiliki rumput liar di kebun maka Anda harus menyingkirkannya. Tetapi ada beberapa knotweed Jepang di klub sepakbola itu dan sedang menyerang fondasi rumah dan perlu ditangani dengan benar. Performa hari ini sangat tengik."" Neville menganggap saat ini dalam skuat United ada semacam rumput liar seperti Knotweed Jepang yang bisa merusak fondasi tim secara keseluruhan. Hal inilah yang harus segera diberantas untuk mencegah kehancuran tim United. Pemain yang dianggap seperti rumput liar tersebut harus segera dikeluarkan. Apa yang dikatakan Neville perlu dipertimbangkan oleh Solskjaer. Musim depan tentu saja Manajer sudah memiliki rencana yang baik. Jangan lupa hilangkan dulu rumput liar tersebut dari skuat United. Solskjaer memerlukan reformasi pemain secara menyeluruh dengan memilih mereka yang memiliki dedikasi dan kesetiaan kepada Manchester United, bukan hanya sekedar uang.   Sebagai Manajer, Solskjaer harus bertanggung jawab penuh atas performa skuat asuhannya. Tugasnya sangat berat menghadapi laga berikutnya. Hal ini karena mereka harus melakukan derby Manchester di Old Trafford. Laga yang sangat penuh gengsi dan krusial untuk membuka peluang kembali ke posisi 4 besar Premier League. "
